"","newDates","snips","items","sources","URL"
"488","Friday, January 31, 2014","CHINA - Another human H7N9 case has been found in east China's Jiangsu Province, the provincial health department confirmed on Friday. ","China Closes Poultry Markets","ShanghaiDaily.com","http://www.thepoultrysite.com/bird-flu/bird-flu-news.php?offset=1460"
"489","Friday, January 31, 2014","GLOBAL - In 2013, 39 cases of H5N1 influenza A in humans were reported to WHO, of whom, 25 died.Worst affected has been Cambodia with 26 reported cases, including 14 deaths. There were four cases (and three deaths) in Egypt; three cases in Indonesia, two each in China and Viet Nam and one case each in Canada and Bangladesh; all but one of the Vietnamese patients died.Since the start of the outbreaks in 2003 to the end of 2013, 649 human cases have been reported to WHO, of whom 385 have died.Viet Nam has reported its first case for 2014; the patient has died.","Cumulative Number of Confirmed Human Cases for H5N1 Influenza Reported to WHO - Update 24 January 2014","World Health Organization","http://www.thepoultrysite.com/bird-flu/bird-flu-news.php?offset=1460"
"490","Friday, January 31, 2014","GLOBAL - An update from the WHO covering: human infection with avian influenza A(H5N1) viruses; human infections with other non-seasonal flu viruses (avian influenza A(H7N9) and (H9N2) in China) and outbreaks in animals with highly pathogenic avian influenza viruses with potential public health impact. ","Influenza at the Human-Animal Interface: Summary and Assessment - 24 January 2014","World Health Organization","http://www.thepoultrysite.com/bird-flu/bird-flu-news.php?offset=1460"
"491","Thursday, January 30, 2014","HONG KONG - The country's competent veterinary authorities have reported an outbreak of low pathogenic avian influenza.","Live Chickens Test Positive for H7N9 Bird Flu in Hong Kong","ThePoultrySite News Desk","http://www.thepoultrysite.com/bird-flu/bird-flu-news.php?offset=1460"
"492","Thursday, January 30, 2014","SOUTH KOREA - A bird flu case has been confirmed at a chicken farm in Gyeonggi Province the government said Thursday, a disturbing sign that all-out quarantine efforts are having limited impact.","Bird Flu Spreads North, Outbreak Confirmed in Gyeonggi Province","The Korea Herald","http://www.thepoultrysite.com/bird-flu/bird-flu-news.php?offset=1460"
"493","Thursday, January 30, 2014","CHINA - All poultry purchased at established markets and properly cooked is safe to eat during the Spring Festival holiday since the H7N9 bird flu virus has not yet been found in the country's poultry farms, a senior agricultural official said.","Poultry Safe from H7N9 if Cooked Properly, Says Official","ThePoultrySite News Desk","http://www.thepoultrysite.com/bird-flu/bird-flu-news.php?offset=1460"
"494","Wednesday, January 29, 2014","CHINA - More cities announced plans to shut down live poultry markets in the face of rising numbers of people infected with the H7N9 strain of bird flu and fears that the Chinese New Year — a peak time for poultry consumption — may worsen the national health threat.","Bird Flu Prompts More Countermeasures","ThePoultrySite News Desk","http://www.thepoultrysite.com/bird-flu/bird-flu-news.php?offset=1460"
"495","Wednesday, January 29, 2014","HONG KONG - Hong Kong's Chief Executive CY Leung on Tuesday questioned local residents' diet habit of cooking live poultry bought from market, since the deadly H7N9 bird flu has forced the government to cull thousands of live chickens to prevent spread of the epidemic.","Chief Exec Challenges Diet Habit after Culling Chickens","ThePoultrySite News Desk","http://www.thepoultrysite.com/bird-flu/bird-flu-news.php?offset=1460"
"496","Wednesday, January 29, 2014","HONG KONG - The Agriculture, Fisheries and Conservation Department (AFCD) has completed the poultry culling operation by around 11pm yesterday (28 January).
","Culling Operation Completed","AFCD","http://www.thepoultrysite.com/bird-flu/bird-flu-news.php?offset=1460"
"497","Tuesday, January 28, 2014","SOUTH KOREA - The South Korean veterinary authorities have reported five outbreaks of highly pathogenic avian influenza (HPAI) in farms located in North Jeolla Province, South Chungcheong Province and South Jeolla Province.","H5N8 Bird Flu Outbreaks in South Korea Kill over 2,000 Ducks","ThePoultrySite News Desk","http://www.thepoultrysite.com/bird-flu/bird-flu-news.php?offset=1460"
"498","Tuesday, January 28, 2014","CHINA - The Chinese veterinary authorities have sent the World Organisation for Animal Health (OIE) an 11th follow-up report on the low pathogenic avian influenza (LPAI) outbreak situation in the country.","China Culls Chickens to Prevent Bird Flu Spread","ThePoultrySite News Desk","http://www.thepoultrysite.com/bird-flu/bird-flu-news.php?offset=1460"
"499","Tuesday, January 28, 2014","HONG KONG - Hong Kong's food and health authority on Monday evening confirmed a H7N9 bird flu case was found at a local agricultural products wholesale market and announced it will cull about 20,000 poultry in the market Tuesday morning.","Hong Kong Confirms H7N9 Bird Flu; to Cull about 20,000 Poultry","ThePoultrySite News Desk","http://www.thepoultrysite.com/bird-flu/bird-flu-news.php?offset=1460"
"500","Tuesday, January 28, 2014","CHINA - Public health experts called for more detailed guidelines to implement a new border inspection policy by the General Administration of Quality Supervision, Inspection and Quarantine for the prevention and control of the human H7N9 bird flu.","Experts Call for Detailed H7N9 Rules","China Daily","http://www.thepoultrysite.com/bird-flu/bird-flu-news.php?offset=1460"
"501","Tuesday, February 18, 2014","CHINA - On 14, 15 and 16 February 2014, the National Health and Family Planning Commission (NHFPC) of China notified WHO of nine additional laboratory-confirmed cases of human infection with avian influenza A(H7N9) virus, including one death.
Six of the nine cases are male. The age range is four to 84 years. Cases were reported from Anhui (2), Guangdong (5), Hunan (1), and Jiangsu (1). Two cases are in a critical condition, three cases are in a severe condition and the condition of three cases are unknown at this point in time. Three cases are reported to have had a history of exposure to live poultry. Investigations are ongoing.","Human Infection with Avian Influenza A(H7N9) Virus – Update 18 February","World Health Organization","http://www.thepoultrysite.com/bird-flu/bird-flu-news.php?offset=1440"
"502","Monday, February 17, 2014","VIET NAM - Six new outbreaks of highly pathogenic avian influenza (HPAI) of the H5N1 sub-type have been reported. Almost 19,000 birds were involved in villages across the country.","Viet Nam Reports Six More H5N1 Outbreaks in Poultry","ThePoultrySite News Desk","http://www.thepoultrysite.com/bird-flu/bird-flu-news.php?offset=1440"
"503","Friday, February 14, 2014","CAMBODIA - The country has reported its first outbreak of H5N1 highly pathogenic avian influenza (HPAI) this year - in two flocks of village ducks in central Cambodia.","Cambodia Reports First H5N1 Bird Flu Outbreak This Year","ThePoultrySite News Desk","http://www.thepoultrysite.com/bird-flu/bird-flu-news.php?offset=1440"
"504","Thursday, February 13, 2014","SINGAPORE - Malaysia has reported its first imported human case of H7N9 in Kota Kinabalu. Singapore's Ministry of Health (MOH) said it is closely monitoring this development and is in close contact with its counterparts.","Low Health Risk in Singapore, Says MOH","Channel NewsAsia","http://www.thepoultrysite.com/bird-flu/bird-flu-news.php?offset=1440"
"505","Thursday, February 13, 2014","CAMBODIA - An eight-year-old boy has died from bird flu in Cambodia, the country’s first confirmed fatality from the deadly virus this year, a health official said Wednesday.","Cambodia Reports First Bird Flu Death ","The Jakarta Post","http://www.thepoultrysite.com/bird-flu/bird-flu-news.php?offset=1440"
"506","Thursday, February 13, 2014","HONG KONG - Hong Kong Wednesday confirmed a new human case of the deadly H7N9 avian flu, the fifth to be discovered in the city.","Hong Kong Reports Fifth H7N9 Bird Flu Case","Bangkok Post","http://www.thepoultrysite.com/bird-flu/bird-flu-news.php?offset=1440"
"507","Thursday, February 13, 2014","VIET NAM - Authorities in the south central province of Quang Nam said Tuesday they have culled flocks of ducks which tested positive for the H5N1 strain of bird flu in some rural communes.","Viet Nam Province Culls Ducks as Bird Flu Threat Re-emerges  ","ThanhNien News.com","http://www.thepoultrysite.com/bird-flu/bird-flu-news.php?offset=1440"
"508","Wednesday, February 12, 2014","CHINA - The low-pathogenic H7N9 avian flu virus has been detected in poultry at five markets between 17 and 28 January.","Low-Path H7N9 Bird Flu Virus Found at Five More Chinese Markets","ThePoultrySite News Desk","http://www.thepoultrysite.com/bird-flu/bird-flu-news.php?offset=1440"
"509","Wednesday, February 12, 2014","SOUTH KOREA - Eleven recent outbreaks of highly pathogenic H5N8 avian influenza in domestic poultry - affecting almost 152,000 birds - have been reported.","South Korea Reports 11 H5N8 Bird Flu Outbreaks","ThePoultrySite News Desk","http://www.thepoultrysite.com/bird-flu/bird-flu-news.php?offset=1440"
"510","Wednesday, February 12, 2014","MALAYSIA - Health officials announced an H7N9 avian flu infection in Malaysia today, the first case detected outside of China, along with eight other newly confirmed cases—one in Hong Kong and seven more from the mainland.
The patients who are sick with H7N9 infections in Hong Kong and Malaysia had travel links to China's Guangdong province, one of the main hotspots of disease activity in the outbreak's second wave.
Today's new cases lift the number of H7N9 cases reported in the second wave, which began in October, to 211, compared with 136 reported during the first wave last spring. For both waves, the total is 347, according to a list of confirmed cases kept by FluTrackers. The unofficial death count remains at 72.","Malaysia Reports First H7N9 Case Outside China","CIDRAP","http://www.thepoultrysite.com/bird-flu/bird-flu-news.php?offset=1440"
"511","Tuesday, February 11, 2014","GLOBAL – Policy progression on Highly Pathogenic Avian Influenza (HPAI) vaccines and vaccination has been explained by International Egg Commission (IEC) Scientific advisor, Dr Vincent Guyonet. ","Discussion Update on Avian Influenza from IEC","ThePoultrySite News Desk","http://www.thepoultrysite.com/bird-flu/bird-flu-news.php?offset=1440"
"512","Tuesday, February 11, 2014","CHINA - The National Health and Family Planning Commission of China has notified WHO of seven additional laboratory-confirmed cases of human infection with avian influenza A(H7N9) virus, including one death.
All three cases are male. The age range is 38 to 61 years. Cases were reported from Hunan (1), Jiangsu (1) and Zhejiang (1). Two of the cases are currently in a critical condition, and the third case is in a severe condition. One of the three cases has been reported to have had a history of exposure to poultry or a live poultry market.","China Confirms Seven New H7N9 Influenza Cases","World Health Organization","http://www.thepoultrysite.com/bird-flu/bird-flu-news.php?offset=1440"
"513","Friday, February 07, 2014","CHINA - Five Chinese people were confirmed to be infected with the H7N9 bird flu Thursday in four regions including Beijing, health authorities said.","China Reports Five New H7N9 Human Cases","China Daily","http://www.thepoultrysite.com/bird-flu/bird-flu-news.php?offset=1440"
"514","Friday, February 07, 2014","VIET NAM - Viet Nam's Health Ministry on Thursday directed the chairpersons of the People's Committees of centrally-run cities and provinces to speed up prevention measures against H7N9 and other strains of the bird flu virus.","Viet Nam Government Steps up Prevention Against Bird Flu","Bernama.com","http://www.thepoultrysite.com/bird-flu/bird-flu-news.php?offset=1440"
"515","Thursday, February 06, 2014","VIET NAM - Viet Nam has recorded its second death from bird flu in 2014, a health official said Thursday, as regional concerns over a potential resurgence of the deadly virus grow.","Viet Nam Reports Second Bird Flu Death in 2014","Channel NewsAsia","http://www.thepoultrysite.com/bird-flu/bird-flu-news.php?offset=1440"
"516","Thursday, February 06, 2014","CHINA - Eleven Chinese people were confirmed to be infected with the H7N9 bird flu on Wednesday in four regions, with eight in critical condition, according to local health authorities.","China Reports 11 New H7N9 Human Cases","China Daily","http://www.thepoultrysite.com/bird-flu/bird-flu-news.php?offset=1440"
"517","Thursday, February 06, 2014","CHINA - The spread of the H7N9 virus among poultry in live bird markets (LBM) in China's Guangxi Province has significantly increased the risk that it will progressively spread to other neighbouring countries of China, posing an increased human health risk, the United Nation's Food and Agriculture Organization (FAO) has warned.","Influenza Virus H7N9 Increasing Risk of Cross-border Spread","ThePoultrySite News Desk","http://www.thepoultrysite.com/bird-flu/bird-flu-news.php?offset=1440"
"518","Wednesday, February 05, 2014","AFRICA - The need has been recognised to update surveillance and contingency measures for influenza A(H7N9) in African countries that have close ties with China, many poultry and a history of H5N1 infections.","African Countries on H7N9 Bird Flu Alert","ThePoultrySite News Desk","http://www.thepoultrysite.com/bird-flu/bird-flu-news.php?offset=1440"
"519","Wednesday, February 05, 2014","CHINA - Chinese scientists sounded the alarm on Wednesday after a new bird flu virus, H10N8, killed an elderly woman in December and infected another individual last month.
The fifth novel influenza strain to emerge in 17 years, the virus has a worrying genetic profile and should be closely monitored, they reported in 'The Lancet' medical journal.","Second Case of H10N8 Leads to Warning of Pandemic Potential","South China Morning Post","http://www.thepoultrysite.com/bird-flu/bird-flu-news.php?offset=1440"
"520","Wednesday, February 05, 2014","CHINA - In a bid at damage control, poultry associations have sent open letters asking the government to temper coverage of the outbreak amid billion-yuan losses.
The national association of poultry farmers and their provincial counterparts in Guangxi and Guangdong have as asked local authorities to “stop reporting individual cases of H7N9”.","China's Poultry Industry Wants to Hush up Bird Flu News ","South China Morning Post","http://www.thepoultrysite.com/bird-flu/bird-flu-news.php?offset=1440"
"521","Wednesday, February 26, 2014","HONG KONG - A bird flu expert says government officials should abandon their plans to resume live chicken imports from the mainland if a permanent segregation site cannot be found.
Malik Peiris, a professor at the University of Hong Kong's School of Public Health, also expressed concern over a plan to store mainland and local poultry at different times at Cheung Sha Wan Wholesale Poultry Market as an interim measure.
""Unless they have a separate place to have live imports from the mainland, this idea of mixing is probably not a good idea,"" said Peiris, who is also acting director of HKU Public Health Laboratory Sciences. ""It is quite risky.""","Forget Mainland China Poultry, Urges Hong Kong Flu Expert","The Standard","http://www.thepoultrysite.com/bird-flu/bird-flu-news.php?offset=1420"
"522","Wednesday, February 26, 2014","GLOBAL - From 2003 to 25 February 2014, 658 laboratory-confirmed human cases of avian influenza A(H5N1) virus infection have been officially reported to WHO from 15 countries. Of these cases, 388 have died.Since the last WHO Influenza at the Human-Animal Interface update on 24 January 2013, eight new laboratory-confirmed human cases of influenza A(H5N1) virus infection were reported to WHO - one from Viet Nam, five from Cambodia and two from China.The WHO report also updates the situation on human infections with avian influenza A(H7N9) and A(H10N8) viruses in China.","Cumulative Number of Confirmed Human Cases for H5N1 Influenza Reported to WHO - Update 25 February 2014","World Health Organization","http://www.thepoultrysite.com/bird-flu/bird-flu-news.php?offset=1420"
"523","Tuesday, February 25, 2014","VIET NAM - The Vietnamese veterinary authorities have reported seven outbreaks of highly pathogenic avian influenza (HPAI) in the provinces if Can Tho, Ba Ria–Vung Tau, Nghe An, Ha Tinh, Quang Binh, Vinh Long and Thanh Hoa.","Viet Nam Reports Seven Outbreaks of H5N1 Bird Flu","ThePoultrySite News Desk","http://www.thepoultrysite.com/bird-flu/bird-flu-news.php?offset=1420"
"524","Tuesday, February 25, 2014","CHINA - Hangzhou government has announced the closure of key live poultry markets — some permanently — to stem the spread of the H7N9 bird flu virus. The announcement was made on 13 February and was effective two days later.
A total of 84 new cases of H7N9 bird flu have been reported in Zhejiang Province this year, including 24 this month, according to the latest statistics released by the province’s Health and Family Planning Commission on February 12. Of the 24 this month, 18 people received treatment in Hangzhou, Statistics released in January showed the province had the highest number of H7N9 cases in China’s mainland at the time.
All live poultry markets in Jianggan, Xiacheng, Shangcheng, Gongshu and Xihu districts have had to close for good, while these located in outlying Xiaoshan and Yuhang Districts had to shut down as of 15 February but will be allowed to reopen in three months.
The ban also forbids citizens to transport any live poultry via public transportation or raise poultry in urban areas to help keep the H7N9 bird flu virus from spreading.","Some Live Poultry Markets in China Closed Permanently","Shanghai Daily","http://www.thepoultrysite.com/bird-flu/bird-flu-news.php?offset=1420"
"525","Monday, February 24, 2014","CHINA - Four more people were confirmed to be infected with H7N9 bird flu in two Chinese provinces on Friday, local authorities said.","China Reports Four More H7N9 Cases","China Daily","http://www.thepoultrysite.com/bird-flu/bird-flu-news.php?offset=1420"
"526","Monday, February 24, 2014","VIET NAM - Deputy Prime Minister Vu Duc Dam has urged better coordinated efforts to fight against measles and bird flu that are plaguing localities nationwide, Vietnam News Agency (VNA) reported.","Deputy PM Urges Concerted Fight Against Bird Flu","Bernama.com","http://www.thepoultrysite.com/bird-flu/bird-flu-news.php?offset=1420"
"527","Monday, February 24, 2014","CHINA - Kuwait Consulate in the Chinese province of Guangzhou on Friday urged Kuwaiti nationals to avoid traveling to the bird flu-hit Zhejiang and Guangdong regions.","Kuwaitis Advised to Avoid Bird Flu-hit Regions in China ","KUNA","http://www.thepoultrysite.com/bird-flu/bird-flu-news.php?offset=1420"
"528","Monday, February 24, 2014","KUWAIT - Kuwaiti Health Ministry announced, Saturday, its readiness to handle any appearance of the bird flu visrus, avian flu H7N9, after the death of dozens of people in China.","Health Ministry Ready to Deal with Bird Flu ","KUNA","http://www.thepoultrysite.com/bird-flu/bird-flu-news.php?offset=1420"
"529","Monday, February 24, 2014","INDIA - The Indian veterinary authorities have reported an outbreak of highly pathogenic H5N1 avian influenza in the state of Odisha.","H5N1 Bird Flu Kills House Crows in Indian State","ThePoultrySite News Desk","http://www.thepoultrysite.com/bird-flu/bird-flu-news.php?offset=1420"
"530","Monday, February 24, 2014","AUSTRALIA - The Australian veterinary authorities reported that there have been no further outbreaks of highly pathogenic avian influenza (HPAI) outbreaks in the country in December 2013.","Australia Completes Decontamination, Disinfection Against H7N2 Bird Flu","ThePoultrySite News Desk","http://www.thepoultrysite.com/bird-flu/bird-flu-news.php?offset=1420"
"531","Monday, February 24, 2014","CHINA - On 20 and 21 February 2014, the National Health and Family Planning Commission (NHFPC) of China notified WHO of nine additional laboratory-confirmed cases of human infection with avian influenza A(H7N9) virus.
Seven of the nine cases are males. The age range is 29 to 81 years. Cases were reported from Anhui (1), Hunan (2), Jilin (1) and Guangdong (5). One case died, six cases are in a critical condition, one case is in a severe condition and one case is in a stable condition. Six cases are reported to have had a history of exposure to live poultry. Investigations are ongoing.","Human Infection with Avian Influenza A(H7N9) Virus – Update 24 February 2014","World Health Organization","http://www.thepoultrysite.com/bird-flu/bird-flu-news.php?offset=1420"
"532","Monday, February 24, 2014","GLOBAL - The World Health Organization outlines the evidence linking the risk of influenza virus transmission from animals to live food markets, particularly poultry.","WHO Explores Links Between Avian Flu, Live Bird Markets","ThePoultrySite News Desk","http://www.thepoultrysite.com/bird-flu/bird-flu-news.php?offset=1420"
"533","Thursday, February 20, 2014","HONG KONG - The veterinary authorities in Hong Kong have reported that there have been no further outbreaks of low pathogenic avian influenza.","Hong Kong Steps up Surveillance of Chicken Farms ","ThePoultrySite News Desk","http://www.thepoultrysite.com/bird-flu/bird-flu-news.php?offset=1420"
"534","Thursday, February 20, 2014","MALAYSIA - FAO says there is no evidence that human patients infected with influenza A(H7N9), a low pathogenic virus in poultry, can transmit the virus to animals, including birds.","FAO Rules Out Human-to-animal Transmission of Influenza A(H7N9)","ThePoultrySite News Desk","http://www.thepoultrysite.com/bird-flu/bird-flu-news.php?offset=1420"
"535","Wednesday, February 19, 2014","CHINA - A new outbreak of H5N1 highly pathogenic avian influenza (HPAI) has resulted in the death or destruction of more than 324,000 poultry on one farm in Guizhou province.","Chinese Poultry Farm Reports H5N1 Bird Flu Outbreak","ThePoultrySite News Desk","http://www.thepoultrysite.com/bird-flu/bird-flu-news.php?offset=1420"
"536","Wednesday, February 19, 2014","CAMBODIA - A four-year-old boy from Cambodia's northeastern Kratie Province has been confirmed for H5N1 human avian influenza, becoming the third case this year, said a joint statement by the World Health Organization and the Cambodian Health Ministry on Wednesday. ","Cambodia Reports Third Bird Flu Case This Year","ShanghaiDaily.com","http://www.thepoultrysite.com/bird-flu/bird-flu-news.php?offset=1420"
"537","Wednesday, February 19, 2014","VIET NAM - Bird flu has been confirmed to have spread to 11 provinces in Viet Nam with 24 outbreaks, said the Department of Animal Health under the Ministry of Agriculture and Rural Development (MARD) on 18 February. ","Bird Flu Confirmed to Have Spread to 11 Provinces in Viet Nam","ShanghaiDaily.com","http://www.thepoultrysite.com/bird-flu/bird-flu-news.php?offset=1420"
"538","Wednesday, February 19, 2014","CHINA - Chinese cities have stepped up control of the live poultry trade as the number of human H7N9 bird flu infections continues to rise.","Chinese Cities Ban Poultry Trading as H7N9 Cases Rise","ThePoultrySite News Desk","http://www.thepoultrysite.com/bird-flu/bird-flu-news.php?offset=1420"
"539","Tuesday, February 18, 2014","CHINA - Avian influenza A(H7N9) virus re-emerged in China in December 2013, after a decrease in the number of new cases during the preceding six months, according to Z. Meng of Fudan University in Shanghai and co-authors.
Reassortment between influenza A(H7N9) and local H9N2 strains has spread from China's south-east coast to other regions. Three new reassortments of A(H7N9) virus were identified by phylogenetic analysis: between A(H7N9) and Zhejiang-derived strains, Guangdong/Hong Kong-derived strains or Hunan-derived A(H9N2) strains.
The authors say their findings suggest there is a possible risk that a pandemic could develop.","Possible Pandemic Threat from New Reassortment of Influenza A(H7N9) Virus in China","EuroSurveillance","http://www.thepoultrysite.com/bird-flu/bird-flu-news.php?offset=1420"
"540","Tuesday, February 18, 2014","VIET NAM - Almost 13,000 village poultry died or were destroyed in four regions of Viet Nam last week as the result of outbreaks of H5N1 highly pathogenic avian influenza (HPAI).","Viet Nam Reports Four New Outbreaks of H5N1 Avian Flu","ThePoultrySite News Desk","http://www.thepoultrysite.com/bird-flu/bird-flu-news.php?offset=1420"
"541","Tuesday, March 04, 2014","VIET NAM - The Vietnamese veterinary authorities have reported four outbreaks of highly pathogenic avian influenza in Hai Duong, Gia Lai, Soc Trang and Hung Yen.","H5N1 Bird Flu in Four Vietnamese Provinces","ThePoultrySite News Desk","http://www.thepoultrysite.com/bird-flu/bird-flu-news.php?offset=1400"
"542","Tuesday, March 04, 2014","SOUTH KOREA - Bird flu has been detected at a government-run facility for animal research despite stringent efforts to contain the spread of the highly contagious virus. ","Bird Flu Found at Public Animal Research Center","The Chosunilbo","http://www.thepoultrysite.com/bird-flu/bird-flu-news.php?offset=1400"
"543","Monday, March 03, 2014","CAMBODIA - Two more children have been confirmed for H5N1 human avian influenza, bringing the number of cases to five so far this year, said a joint statement by the World Health Organization and the Cambodian Health Ministry Friday.","Cambodia Reports Two More New Human Cases of Bird Flu","Xinhua Online","http://www.thepoultrysite.com/bird-flu/bird-flu-news.php?offset=1400"
