"","newDates","snips","items","sources","URL"
"1","Monday, February 11, 2013","KUWAIT - The Public Authority for Agriculture and Fish Resources announced, Sunday, a ban on import of all poultry, eggs, and chicks from Denmark, following international reports indicating the spread of bird flu in the country.","Kuwait Bans Poultry Imports from Denmark","Kuwait News Agency (KUNA)","http://www.thepoultrysite.com/bird-flu/bird-flu-news.php?offset=1940"
"2","Monday, February 11, 2013","BHUTAN - The Bhutanese veterinary authorities have reported an outbreak of highly pathogenic avian influenza affecting farms with backyard free ranging local chicken in Chuzargang and Namkhaling villages, and in backyard and improved chicken in Pelrithang village, all located in Sarpang.","Bhutan Reports HPAI in Sarpang","ThePoultrySite News Desk","http://www.thepoultrysite.com/bird-flu/bird-flu-news.php?offset=1940"
"3","Friday, February 08, 2013","CAMBODIA - Five people have died from bird flu in Cambodia this year, authorities said Friday, up from three for the whole of 2012.","Bird Flu Deaths Reach Five in Cambodia","The Nation","http://www.thepoultrysite.com/bird-flu/bird-flu-news.php?offset=1940"
"4","Thursday, February 07, 2013","PHILIPPINES - The Department of Agriculture (DA) has temporarily suspended the importation of poultry and other poultry products from Germany, because of the occurrence of an outbreak of two separate strings of avian influenza.","Govt Stops German Poultry Imports ","The Manila Times.net","http://www.thepoultrysite.com/bird-flu/bird-flu-news.php?offset=1940"
"5","Thursday, February 07, 2013","BANGLADESH - The Bangladeshi veterinary authorities have reported another outbreak of highly pathogenic avian influenza (HPAI) at a commercial poultry farm in Dhaka.","Bangladesh Reports Another HPAI Outbreak","ThePoultrySite News Desk","http://www.thepoultrysite.com/bird-flu/bird-flu-news.php?offset=1940"
"6","Thursday, February 07, 2013","US & MEXICO - Current inactivated H7 vaccines were found in USDA ARS studies to be effective against the H7N3 subtype of the highly pathogenic avian influenza (HPAI) virus that caused the outbreaks of bird flu in Mexico in 2012 and a similar low-pathogenic virus of the same subtype. ","Evaluation of Inactivated Avian Influenza H7 Vaccines for Protection of Chickens against an HPAI Virus H7N3 Isolated from Chickens in Jalisco, Mexico, in 2012 ","ThePoultrySite","http://www.thepoultrysite.com/bird-flu/bird-flu-news.php?offset=1940"
"7","Tuesday, February 05, 2013","NEPAL - Banke, Bardiya and Dang of Mid-western Tarai region are at high risk of bird flu, sources said.
","Tarai Districts at High Risk of Bird Flu","The Himalayan","http://www.thepoultrysite.com/bird-flu/bird-flu-news.php?offset=1940"
"8","Friday, February 01, 2013","AUSTRALIA - Australian researchers are taking part in a global project to help protect people against the deadly bird flu virus.","Australia on Board in Global Bird Flu Fight","Radio Australia","http://www.thepoultrysite.com/bird-flu/bird-flu-news.php?offset=1940"
"9","Friday, February 01, 2013","AUSTRALIA - Researchers in Newcastle are doing their bit to help protect the world against a potentially deadly outbreak of the bird flu virus.","Volunteers Wanted for Bird Flu Vaccine Trial","ABC News","http://www.thepoultrysite.com/bird-flu/bird-flu-news.php?offset=1940"
"10","Friday, February 01, 2013","CAMBODIA - The Cambodian veterinary authorities have reported an outbreak of highly pathogenic avian influenza at a village in Kong Pisei District.","Cambodia Reports HPAI in Kong Pisei District","ThePoultrySite News Desk","http://www.thepoultrysite.com/bird-flu/bird-flu-news.php?offset=1940"
"11","Friday, February 01, 2013","HONG KONG - A spokesman for the Agriculture, Fisheries and Conservation Department (AFCD) said today (1 February) that a black-headed gull found in Tuen Mun last week was confirmed to be H5N1-positive after a series of laboratory tests.","Black-headed Gull Tests Positive for H5N1 Virus","ThePoultrySite News Desk","http://www.thepoultrysite.com/bird-flu/bird-flu-news.php?offset=1940"
"12","Friday, February 01, 2013","GLOBAL - According to WHO, there were five cases of H5N1 flu in humans so far this year, all in Cambodia. Four of them have been fatal.

In 2012, there were a total of 32 cases of H5N1 flu in humans, 20 of whom died. 

Most of the victims were in Egypt (11 cases; five deaths) but there were also nine cases in Indonesia, four in Viet Nam, three in Bangladesh and Cambodia and two in China.

There were 62 cases in 2011, of whom, 34 died.

Since the emergence of H5N1 influenza in 2003, 615 people are reported to have become infected, 364 of whom have died.","WHO: Five Cases of H5N1 Flu So Far This Year, All in Cambodia","WHO","http://www.thepoultrysite.com/bird-flu/bird-flu-news.php?offset=1940"
"13","Thursday, January 31, 2013","INDONESIA - Indonesia will produce about 10 million doses of avian influenza vaccine for ducks in February following the death of hundreds of thousands of the birds in Java island in recent months.
","Indonesia to Produce 10 Million Doses of Bird Flu Vaccine","Bernama.com","http://www.thepoultrysite.com/bird-flu/bird-flu-news.php?offset=1940"
"14","Tuesday, January 29, 2013","CAMBODIA - ","Bird Flu Kills Two Cambodian Children, Taking 2013 Toll to Four","The Nation","http://www.thepoultrysite.com/bird-flu/bird-flu-news.php?offset=1940"
"15","Tuesday, January 29, 2013","GLOBAL - The world risks a repeat of the disastrous 2006 bird flu outbreaks unless surveillance and control of this and other dangerous animal diseases is strengthened globally, FAO warns.","FAO Urges Stronger Measures on Global Health Threats","ThePoultrySite News Desk","http://www.thepoultrysite.com/bird-flu/bird-flu-news.php?offset=1940"
"16","Monday, January 28, 2013","CAMBODIA - Two Cambodians have died from bird flu contracted while preparing infected chicken, the World Health Organization said Friday.","Two Cambodians Die from Bird Flu: WHO","ChannelNewsAsia.com","http://www.thepoultrysite.com/bird-flu/bird-flu-news.php?offset=1940"
"17","Thursday, January 24, 2013","MEXICO - On 16 January 2013, the National Service of Health, Food Safety, and Food Quality (SENASICA) informed the World Organisation for Animal Health (OIE) of another newly detected highly pathogenic avian influenza (HPAI) serotype H7N3 outbreak that occurred at two layer farms in the State of Jalisco. ","HPAI H7N3 Erupts Again in Jalisco","ThePoultrySite News Desk","http://www.thepoultrysite.com/bird-flu/bird-flu-news.php?offset=1940"
"18","Thursday, January 24, 2013","DENMARK - The Danish veterinary authorities have reported finding an H7 highly pathogenic avian influenza (HPAI) virus in five wild mallard ducks, Anas platyrhynchos, in the west of the country.","Denmark Reports HPAI in Wild Duck","ThePoultrySite News Desk","http://www.thepoultrysite.com/bird-flu/bird-flu-news.php?offset=1940"
"19","Thursday, January 24, 2013","TAIWAN - The Taiwanese veterinary authorities have reported two new outbreaks of low pathogenic avian influenza at farms located in P'eng-Hu or the Penghu Islands and in Miaoli County.","More LPAI Outbreaks Reported in Taiwan","ThePoultrySite News Desk","http://www.thepoultrysite.com/bird-flu/bird-flu-news.php?offset=1940"
"20","Thursday, January 24, 2013","NEPAL - The Nepali veterinary authorities have reported four new outbreaks of highly pathogenic avian influenza (HPAI) at various commercial broiler farms located in Gandaki.","Nepal Reports More HPAI H5N1 Outbreaks in Gandaki","ThePoultrySite News Desk","http://www.thepoultrysite.com/bird-flu/bird-flu-news.php?offset=1940"
"21","Tuesday, February 26, 2013","VIET NAM - Authorities in Ho Chi Minh City have ordered local agencies to step up preventive measures against avian flu, which has spread back into Vietnam via Cambodia recently, Dan Tri reported Thursday. ","HCMC Braces for Bird Flu as H5N1 Moves in from Cambodia  ","ThanhNien News.com","http://www.thepoultrysite.com/bird-flu/bird-flu-news.php?offset=1920"
"22","Tuesday, February 26, 2013","CHINA - China's quarantine authority announced on Monday that it has ordered strengthened prevention against avian influenza H5N1 after the disease infected five people in Cambodia last month.","China Alert for Bird Flu from Cambodia","ThePoultrySite News Desk","http://www.thepoultrysite.com/bird-flu/bird-flu-news.php?offset=1920"
"23","Tuesday, February 26, 2013","CAMBODIA - Cambodia reported on Tuesday that a 35-year-old man died of Avian Influenza H5N1, bringing the death toll to eight and the number of cases to nine in 2013, health officials and victim's family said Tuesday.","Cambodia Reports 9th Bird Flu Case, 8th Death So Far This Year","Bernama.com","http://www.thepoultrysite.com/bird-flu/bird-flu-news.php?offset=1920"
"24","Tuesday, February 26, 2013","MEXICO - Pilgrim's Pride Corporation has identified an increased mortality rate of the breeder flock at the Company's complex located in the state of Guanajuato in central Mexico.","Pilgrim's Pride Takes Affirmative Steps to Protect Breeder Supply","ThePoultrySite News Desk","http://www.thepoultrysite.com/bird-flu/bird-flu-news.php?offset=1920"
"25","Friday, February 22, 2013","BANGLADESH - The poultry industry is gradually picking up owing to a drop in frequency of bird flu attacks in farms, industry leaders said yesterday.","Poultry Industry Rebounds as Bird Flu Attacks Recede","The Daily Star","http://www.thepoultrysite.com/bird-flu/bird-flu-news.php?offset=1920"
"26","Friday, February 22, 2013","AUSTRALIA - CSIRO scientists have helped to design a new drug to safeguard against epidemic and pandemic flu strains – as published in ""Science"".","New Drug Developed to Combat Flu Pandemic","ThePoultrySite News Desk","http://www.thepoultrysite.com/bird-flu/bird-flu-news.php?offset=1920"
"27","Friday, February 22, 2013","NEPAL - Bird flu outbreaks have killed 70,000 chickens worth Rs 29.4 million since 2008. The country has witnessed 38 outbreaks in the last four years. ","Bird Flu Kills Chickens Worth Rs 29.4 Million ","The Himalayan","http://www.thepoultrysite.com/bird-flu/bird-flu-news.php?offset=1920"
"28","Thursday, February 21, 2013","CAMBODIA - A 2-year-old boy has died of Avian Influenza H5N1, bringing death toll to seven and total cases in Cambodia to eight this year, Xinhua news agency reported.","Cambodia's Bird Flu Toll Hits Seven This Year","Bernama.com","http://www.thepoultrysite.com/bird-flu/bird-flu-news.php?offset=1920"
"29","Wednesday, February 20, 2013","HONG KONG - Import of all poultry and poultry products, including poultry eggs, from the states of Brandenburg and Berlin of Germany, has been banned with immediate effect for the protection of Hong Kong's public and animal health, the Center for Food Safety (CFS) of the Food and Environmental Hygiene Department announced Tuesday, 19 February.","HK Bans Poultry Products Imports from Germany","ThePoultrySite News Desk","http://www.thepoultrysite.com/bird-flu/bird-flu-news.php?offset=1920"
"30","Wednesday, February 20, 2013","GLOBAL - Summary of a report from FAO covering a technical stocktaking of outputs, outcomes, best practices and lessons learned from the fight against highly pathogenic avian influenza in Asia between 2005 and 2011. The lessons learned, which are covered in this article, include those relating to politics, coordination, surveillance, epidemiology, laboratory capacity, biosecurity, socio-economics and communication. 

","Lessons from HPAI","FAO","http://www.thepoultrysite.com/bird-flu/bird-flu-news.php?offset=1920"
"31","Tuesday, February 19, 2013","GERMANY - Low-pathogenic avian influenza of the H5N1 sub-type has been reported on a duck farm in the state of Brandenburg.","Germany Reports Low-Path Bird Flu on Duck Farm","ThePoultrySite News Desk","http://www.thepoultrysite.com/bird-flu/bird-flu-news.php?offset=1920"
"32","Tuesday, February 19, 2013","MEXICO - Industrias Bachoco has announced that the Mexican Sanitary Authority SENASICA (Servicio Nacional de Sanidad Inocuidad y Calidad Alimentaria) confirmed the presence of avian influenza H7N3 at some of the Company's farms. All of the affected farms are located in the same region within the State of Guanajuato.","Mexican Sanitary Authorities Confirm Avian Flu","ThePoultrySite News Desk","http://www.thepoultrysite.com/bird-flu/bird-flu-news.php?offset=1920"
"33","Monday, February 18, 2013","CHINA - A total of 110 people who had close contact with two patients contracted avian influenza H5N1 in Southwest China's Guizhou province earlier this month have been released from quarantine, local health authorities announced on Sunday, 17 February.","110 Released from Bird Flu Quarantine","ThePoultrySite News Desk","http://www.thepoultrysite.com/bird-flu/bird-flu-news.php?offset=1920"
"34","Monday, February 18, 2013","MEXICO - The chief director of SENASICA, Enrique Sanchez Cruz, has been instructed to reinforce diagnostic activities and narrow the movement controls of poultry and products in affected bird flu-affected areas.","SENASICA Strengthens Poultry Surveillance in Guanajuato","ThePoultrySite News Desk","http://www.thepoultrysite.com/bird-flu/bird-flu-news.php?offset=1920"
"35","Friday, February 15, 2013","MEXICO - Industrias Bachoco Mexico's leading producer and processor of poultry and other food products, announced that a possible outbreak of avian influenza H7N3 has been detected in five breeder farms located in the state of Guanajuato.","Bachoco Suspicious of Avian Flu in Five Breeder Farms","ThePoultrySite News Desk","http://www.thepoultrysite.com/bird-flu/bird-flu-news.php?offset=1920"
"36","Friday, February 15, 2013","NEPAL - The Nepalese veterinary authorities have reported five new outbreaks of highly pathogenic avian influenza at farms located in Mechi and Bagmati.","HPAI Outbreaks in Bagmati and Mechi","ThePoultrySite News Desk","http://www.thepoultrysite.com/bird-flu/bird-flu-news.php?offset=1920"
"37","Thursday, February 14, 2013","BANGLADESH - Over 2000 fowls have been culled following detection of bird flu virus at a poultry farm in Islampara area of Chuadanga district town. ","2,000 Fowls Culled in Chuadanga District","The Daily Star","http://www.thepoultrysite.com/bird-flu/bird-flu-news.php?offset=1920"
"38","Wednesday, February 13, 2013","CAMBODIA - Cambodia has reported that another 4-year-old girl has contracted avian flu H5N1, this being the seventh person to be infected by the virus this year.","Cambodia Reports 7th Bird Flu Case This Year","ThePoultrySite News Desk","http://www.thepoultrysite.com/bird-flu/bird-flu-news.php?offset=1920"
"39","Wednesday, February 13, 2013","CHINA - A woman in southwestern China died of bird flu on Wednesday, state media said, a rare case in the country of a fatality from the H5N1 virus since a major outbreak a decade ago.","Chinese Woman Dies of Bird Flu","ChannelNewsAsia.com","http://www.thepoultrysite.com/bird-flu/bird-flu-news.php?offset=1920"
"40","Monday, February 11, 2013","CHINA - China on Sunday (10 February) reported two human cases of highly pathogenic avian influenza H5N1 in southwestern city of Guiyang, the Ministry of Health announced.","Two Cases of Human Bird Flu Reported in SW China","ThePoultrySite News Desk","http://www.thepoultrysite.com/bird-flu/bird-flu-news.php?offset=1920"
"41","Thursday, March 21, 2013","NETHERLANDS - Avian Influenza, also known as bird flu, was detected on an organic poultry farm with 24,000 hens in Zeewolde, the Dutch Ministry of Economic Affairs has reported.","Bird Flu Found on Dutch Poultry Farm","ThePoultrySite News Desk","http://www.thepoultrysite.com/bird-flu/bird-flu-news.php?offset=1900"
"42","Thursday, March 21, 2013","GLOBAL - With the support of the Food and Agriculture Organization of the United Nations (FAO) and the joint FAO/International Atomic Energy Agency (IAEA) division, the Swiss Institute of Bioinformatics (SIB) initiated the development of a publicly accessible e-learning bioinformatics course on animal viral pathogens.","E-learning Modules on Bioinformatics in Animal Viral Pathogens ","ThePoultrySite News Desk","http://www.thepoultrysite.com/bird-flu/bird-flu-news.php?offset=1900"
"43","Thursday, March 21, 2013","CHINA - The first round of sampling of the China component of the Emerging Pandemic Threats Plus (EPT+) Project was successfully completed in January.","Successful Completion of First Round of Sampling","ThePoultrySite News Desk","http://www.thepoultrysite.com/bird-flu/bird-flu-news.php?offset=1900"
"44","Tuesday, March 19, 2013","CANADA - A group of lethal bacteria are of increasing concern worldwide because they are becoming resistant to many or all of the antibiotics previously effective against them. Bioradar UK Ltd. has announced in Ottawa that it has discovered that the concentration of genomic Replikins is markedly increased in antibiotic-resistant bacteria. This finding is permitting a new approach to the problem of antibiotic resistance.","Antibiotic-Resistant Bacteria Have High Genomic Replikin Counts","ThePoultrySite News Desk","http://www.thepoultrysite.com/bird-flu/bird-flu-news.php?offset=1900"
"45","Friday, March 15, 2013","INDIA - The Bihar government has asked the officials of the Animal Husbandry Department (AHD) to take all preventive measures and keep a close tab on chickens in those areas where bird flu H5N1 type virus had been detected.","6,000 Birds Culled in Bihar After Bird Flu Threat","Deccan Herald","http://www.thepoultrysite.com/bird-flu/bird-flu-news.php?offset=1900"
"46","Thursday, March 14, 2013","NETHERLANDS - The Dutch veterinary authorities have reported an outbreak of low pathogenic avian influenza (Serotype H7N7) at a farm in Gelderland.","Netherlands Reports Outbreak of LPAI in Gelderland","ThePoultrySite News Desk","http://www.thepoultrysite.com/bird-flu/bird-flu-news.php?offset=1900"
"47","Thursday, March 14, 2013","GLOBAL - Ceva has confirmed that initial results in Egypt for Vectormune AI are positive, supporting the high hopes that the company has for its ground-breaking vector vaccine for H5 avian influenza.","Ceva Confirms Early Vectormune AI Field Results","CEVA ","http://www.thepoultrysite.com/bird-flu/bird-flu-news.php?offset=1900"
"48","Wednesday, March 13, 2013","CAMBODIA - The Cambodian veterinary authorities have reported a further outbreak of highly pathogenic avian influenza at a poultry farm located in Siem Reap province.","More HPAI Reported in Cambodia's Siem Reap Province","ThePoultrySite News Desk","http://www.thepoultrysite.com/bird-flu/bird-flu-news.php?offset=1900"
"49","Tuesday, March 12, 2013","BANGLADESH - More than 1800 chickens were culled and 400 eggs destroyed following detection of bird flu virus at a poultry farm in Sadar upazila of Rajbari district on Sunday night.","Bird Flu Affected Chickens Culled in Rajbari","The Daily Star","http://www.thepoultrysite.com/bird-flu/bird-flu-news.php?offset=1900"
"50","Tuesday, March 12, 2013","AUSTRALIA - A duck at a property north-east of Perth has been diagnosed with low pathogenic H5 avian influenza.","Bird Flu Found in Perth Duck","WAtoday.com.au","http://www.thepoultrysite.com/bird-flu/bird-flu-news.php?offset=1900"
"51","Monday, March 11, 2013","INDIA - More than 2,000 chickens were culled and a large quantity of eggs destroyed in Bihar's Purnea district in the last 24 hours following an outbreak of avian flu, officials said Monday.","Over 2000 Chickens Culled in Bihar","The New Indian Express","http://www.thepoultrysite.com/bird-flu/bird-flu-news.php?offset=1900"
"52","Friday, March 08, 2013","AUSTRALIA - The Australian veterinary authorities have reported an outbreak of low pathogenic avian influenza at Henley Brook in Western Australia.","Low Pathogenic Avian Influenza in Western Australia","ThePoultrySite News Desk","http://www.thepoultrysite.com/bird-flu/bird-flu-news.php?offset=1900"
"53","Thursday, March 07, 2013","BANGLADESH - The feed industry is recovering on the back of rising poultry farming in recent months, industry people said yesterday.","Feed Industry Rebounds as Bird Flu Ebbs","The Daily Star","http://www.thepoultrysite.com/bird-flu/bird-flu-news.php?offset=1900"
"54","Wednesday, March 06, 2013","VIET NAM - Viet Nam is facing a high risk of bird flu outbreaks due to unfavorable weather conditions which reduce the animals' resistance according to the Animal Health Department under the Ministry of Agriculture and Rural Development (MARD).","Viet Nam Put on High Alert to Bird Flu Outbreaks","ThePoultrySite News Desk","http://www.thepoultrysite.com/bird-flu/bird-flu-news.php?offset=1900"
"55","Wednesday, March 06, 2013","CHINA - China's Ministry of Agriculture (MOA) and the Food and Agriculture Organization (FAO) of the United Nations have jointly held a Plaque-unveiling Ceremony for the FAO Reference Center for Animal Influenza in Harbin.","Harbin Flu Lab Designated as FAO Reference Centre","ThePoultrySite News Desk","http://www.thepoultrysite.com/bird-flu/bird-flu-news.php?offset=1900"
"56","Monday, March 04, 2013","MEXICO - The National Service of Health, Food Safety and Quality (SENASICA) is planning on applying about 210 million doses of AH7N3 vaccines per month in nine states across the country in order to prevent further outbreaks.","SENASICA Authorises Vaccination Against AH7N3 in Nine States","ThePoultrySite News Desk","http://www.thepoultrysite.com/bird-flu/bird-flu-news.php?offset=1900"
"57","Friday, March 01, 2013","MEXICO - The dreaded avian influenza has returned to central Mexico again this year, this time causing significant poultry deaths in Guanajuato state, writes Carlos Navarro, Editor of SourceMex.","Avian Influenza Outbreak in Mexico Raises Concerns about Price Speculation","ThePoultrySite News Desk","http://www.thepoultrysite.com/bird-flu/bird-flu-news.php?offset=1900"
"58","Thursday, February 28, 2013","NEPAL - The government has distributed about Rs 10 million in the last four years to bird flu affected farmers. The Animal Health Directorate provided the compensation to over five dozen farmers.","Govt Helps Bird Flu Affected Farmers ","The Himalayan","http://www.thepoultrysite.com/bird-flu/bird-flu-news.php?offset=1900"
"59","Thursday, February 28, 2013","MEXICO - Mexican animal health authorities have carried out inspections on 158 poultry production units in the state of Guanajuato as well as farms in Aguascalientes and Jalisco.","Mexico Continues to Carry out Biosecurity Measures","ThePoultrySite News Desk","http://www.thepoultrysite.com/bird-flu/bird-flu-news.php?offset=1900"
"60","Tuesday, February 26, 2013","INDIA - The Odisha government has asked the local administration of three districts, two in the coastal region and one in the southern zone, to remain in high alert after a confirmed case of bird flu was detected in Chilka lake which houses one of the topmost winter homes for migratory birds in the country. ","Bird Flu Outbreak in Chilka Lake","Deccan Herald","http://www.thepoultrysite.com/bird-flu/bird-flu-news.php?offset=1900"
"61","Wednesday, April 10, 2013","CHINA - A preliminary analysis shows that H7N9 bird flu has not triggered an epidemic among poultry, according to a Tuesday report in the ""People's Daily"" that cited a veterinary expert.","No H7N9 Epidemic Among Poultry, Says Expert","ThePoultrySite News Desk","http://www.thepoultrysite.com/bird-flu/bird-flu-news.php?offset=1880"
"62","Tuesday, April 09, 2013","CHINA - H7N9 avian influenza in China is put into perspective by Wageningen University, which says that it is exceptional that human fatalities have occurred there after infection with low pathogenic H7N9 avian influenza virus. ","China's Flu Deaths Caused by Low-Pathogenic Virus","ThePoultrySite News Desk","http://www.thepoultrysite.com/bird-flu/bird-flu-news.php?offset=1880"
"63","Tuesday, April 09, 2013","CHINA - Chinese officials have expressed confidence in curbing the H7N9 strain of bird flu, stating how the country has built capacity to deal with epidemics since the SARS outbreak.","Bird Flu Can be Contained, Say Chinese Officials","ThePoultrySite News Desk","http://www.thepoultrysite.com/bird-flu/bird-flu-news.php?offset=1880"
"64","Tuesday, April 09, 2013","NIGERIA - Responding to the occurrence of the A(H7N9) influenza virus in China, the Food and Agriculture Organisation (FAO) has warned Nigeria and other countries in the region to be cautious in the implementation of their biosecurity measures, to prevent any occurrence of the new bird flu strain.","FAO Moves to Tackle Bird Flu Spread, Cautions Nigeria","This Day Live","http://www.thepoultrysite.com/bird-flu/bird-flu-news.php?offset=1880"
"65","Tuesday, April 09, 2013","INDONESIA - Badminton-crazy Indonesia is concerned a deadly bird flu outbreak could claim an unlikely victim — the shuttlecock — officials said Tuesday after the government banned imports of Chinese duck feathers.
","Indonesia Fears Shuttlecock Shortage Due to China Bird Flu","JakartaGlobe","http://www.thepoultrysite.com/bird-flu/bird-flu-news.php?offset=1880"
"66","Monday, April 08, 2013","CHINA - China reported three more H7N9 infections on Sunday, bringing total number of the confirmed cases to 21 as the country is gearing up to fight the disease that has left six dead.","China Confirms 21 Cases of H7N9 Infection","ThePoultrySite News Desk","http://www.thepoultrysite.com/bird-flu/bird-flu-news.php?offset=1880"
"67","Monday, April 08, 2013","CHINA - All live poultry trade should be suspended and poultry markets shut down temporarily in the capital city of east China's H7N9 bird flu-afflicted Jiangsu Province, according to a government statement.","Nanjing Shuts Down Poultry Markets","ThePoultrySite News Desk","http://www.thepoultrysite.com/bird-flu/bird-flu-news.php?offset=1880"
