"","newDates","snips","items","sources","URL"
"906","Wednesday, January 14, 2015","US - Californian chickens are at increased risk of infection from a severe ‘bird flu’ strain and all flock owners need to raise biosecurity levels, warns the University of California Davis.","Californian Poultry Keepers Warned of Avian Flu Risks","ThePoultrySite News Desk","http://www.thepoultrysite.com/bird-flu/bird-flu-news.php?offset=1040"
"907","Wednesday, January 14, 2015","GERMANY - The state of Lower Saxony has confirmed no new cases of H5N8 highly pathogenic avian influenza in poultry although some disease security measures remain in place as the virus has been detected in seagulls away from domestic poultry.","Bird Flu Measures Relaxed in Lower Saxony","ThePoultrySite NewsDesk","http://www.thepoultrysite.com/bird-flu/bird-flu-news.php?offset=1040"
"908","Wednesday, January 14, 2015","TAIWAN - The veterinary authority reported nine outbreaks of H5N2 highly pathogenic avian influenza on goose farms on 8 and 9 January. Six were in Yunlin county in the west of the country, two in neighbouring Chiayi country and one in Pingtung county in the south. Abnormal deaths and sudden death were observed in 10,720 of the 29,250 breeding and fattening birds in these flocks. Movement of birds has been halted and culling of the remaining birds has begun.","Taiwan Reports Nine Outbreaks of  H5N2 Avian Flu in Goose Flocks","OIE","http://www.thepoultrysite.com/bird-flu/bird-flu-news.php?offset=1040"
"909","Tuesday, January 13, 2015","CHINA & US - The Chinese government has announced that it will ban all imports of US poultry and egg products because of recent detections in the US of highly pathogenic avian influenza (HPAI) in backyard poultry and wild birds in the Pacific Northwest. The US industry says it expected China to take a regional approach, at the most, in line with international trade guidelines.","China Bans Imports of All US Poultry, Products","ThePoultrySite News Desk","http://www.thepoultrysite.com/bird-flu/bird-flu-news.php?offset=1040"
"910","Tuesday, January 13, 2015","TAIWAN - Eleven new farms have tested positive for avian influenza in ducks and geese, bringing the total number affected to 20. Both highly pathogenic H5N8 and low-pathogenic H5N2 variants have been detected.","Avian Flu Spreads in Taiwan","ThePoultrySite News Desk","http://www.thepoultrysite.com/bird-flu/bird-flu-news.php?offset=1040"
"911","Tuesday, January 13, 2015","CHINA - Two additional human cases of avian influenza A(H7N9) have been notified by the Health and Family Planning Commission of Guangdong Province (GDHFPC). One is a male patient (aged 42) in Shenzhen and the other is a female patient (aged 52) in Dongguan. Both have been admitted to hospital and are in a critical condition.To date, 460 human cases of avian influenza A(H7N9) have been reported by the Mainland health authorities.","Two New Avian Flu Cases in Guangdong","Hong Kong's Centre for Health Protection (CHP)","http://www.thepoultrysite.com/bird-flu/bird-flu-news.php?offset=1040"
"912","Tuesday, January 13, 2015","CHINA - Since December 2013, at least three cases of human infections with H10N8 avian influenza virus have been reported in China, two of them being fatal, according to Min Wang at China Agricultural University and other. In an investigation into the epidemic potential of H10N8 viruses, they found this type to be less likely to bind to human receptor sites than those in birds.","Structural Basis for Preferential Avian Receptor Binding by the Human-infecting H10N8 Avian Influenza Virus","Nature","http://www.thepoultrysite.com/bird-flu/bird-flu-news.php?offset=1040"
"913","Tuesday, January 13, 2015","NIGERIA - An outbreak of H5 highly pathogenic avian influenza has been reported in a mixed backyard chicken flock in the northern state of Kano.","Nigeria Reports Highly Pathogenic Avian Flu in Chicken Flock","ThePoultrySite News Desk","http://www.thepoultrysite.com/bird-flu/bird-flu-news.php?offset=1040"
"914","Tuesday, January 13, 2015","CHINA - Highly pathogenic H5N1 avian flu has led to the death of more than 20,000 birds at a farm in the province in Jiangxi.","H5N1 Outbreak Hits Commercial Chicken Flock in Jiangxi","ThePoultrySite News Desk","http://www.thepoultrysite.com/bird-flu/bird-flu-news.php?offset=1040"
"915","Tuesday, January 13, 2015","JAPAN - A wild bird - a hooded crane (Grus monacha) - was found dead at Izumi-shi in Kagoshima prefecture on 3 January. It has since tested positive for the H5N8 highly pathogenic avian influenza virus. ","H5N8 Virus Detected in Hooded Crane in Kagoshima","World Organisation for Animal Health","http://www.thepoultrysite.com/bird-flu/bird-flu-news.php?offset=1040"
"916","Monday, January 12, 2015","INDIA - On 11 January, the Sultanpur bird sanctuary at Gurgaon near New Dehli was shut for a week after 45 birds were found dead in its lake. The officials concerned, who had been keeping a close watch on the birds’ health after temporary closure of Chandigarh’s Sukhna Lake due to bird flu scare, were surprised over the sudden death of the birds and shut the bird sanctuary as a precautionary measure.","Bird Flu Scare: Sultanpur Sanctuary Shut","The Tribune","http://www.thepoultrysite.com/bird-flu/bird-flu-news.php?offset=1040"
"917","Monday, January 12, 2015","EGYPT - There are three new confirmed cases of bird flu, the health ministry has said. The new cases include a 10-year-old boy from Upper Egypt's Aswan.The ministry said this brings the total number of bird flu cases in 2015 to 10, of which seven are currently being treated. Two people were already diagnosed and treated so far this year. One person has died from the virus (N5H1) in 2015 — a three-year-old toddler from Giza. Last year, 11 people died of bird flu nationwide.","Three New Cases of H5N1 Bird Flu in Egypt","Ahram Online","http://www.thepoultrysite.com/bird-flu/bird-flu-news.php?offset=1040"
"918","Monday, January 12, 2015","WASHINGTON, US - USDA has sent a team to the south-east of Washington state to assist in the response to outbreaks of H5N2 highly pathogenic avian influenza in two backyard flocks.","Expert Teams Respond to Avian Flu in Washington State","ThePoultrySite News Desk","http://www.thepoultrysite.com/bird-flu/bird-flu-news.php?offset=1040"
"919","Monday, January 12, 2015","TAIWAN - The H5N2 avian influenza virus was detected at four goose farms in Yunlin and a duck farm in Pingtung as H5N8 avian flu has hit a goose farm in Chiayi.","H5N2, H5N8 Bird Flu Hit Taiwanese Poultry Farms","ThePoultrySite News Desk","http://www.thepoultrysite.com/bird-flu/bird-flu-news.php?offset=1040"
"920","Monday, January 12, 2015","CHINA - The poultry sector in the province of Fujian has been hit hard as the result of scares of H7N9 bird flu, which has cut poultry meat consumption sharply.","Poultry Prices Plummet in China on Bird Flu Fears","ThePoultrySite News Desk","http://www.thepoultrysite.com/bird-flu/bird-flu-news.php?offset=1040"
"921","Friday, January 23, 2015","GERMANY - Four chickens died at a zoo in Anklam in the region of Vorpommern-Greifswald on 20 January. They were among a group of 98 birds of six species (with geese, ducks, pigeons, psittacides and quails) kept for non-commercial purposes. The H5N8 virus has been identified and 47 of the birds have been destroyed.","Bird Flu Hits Zoo Birds in Mecklenburg-Western Pomerania, Germany","World Organisation for Animal Health","http://www.thepoultrysite.com/bird-flu/bird-flu-news.php?offset=1020"
"922","Thursday, January 22, 2015","TAIWAN - More than 260,000 birds - predominantly geese - have been involved in 61 new outbreaks of highly pathogenic avian influenza of three different H5 virus subtypes reported by the national veterinary authority in one day.","Taiwanese Goose Industry Hit by Tidal Wave of High-path Avian Flu","ThePoultrySite News Desk","http://www.thepoultrysite.com/bird-flu/bird-flu-news.php?offset=1020"
"923","Thursday, January 22, 2015","PALESTINIAN TERRITORY - A farmer in the West Bank culled his two turkey flocks last week on suspicion of high-path avian flu, which has since been confirmed as an H5 subtype.","Avian Flu Hits Turkeys in Palestine's West Bank","ThePoultrySite News Desk","http://www.thepoultrysite.com/bird-flu/bird-flu-news.php?offset=1020"
"924","Thursday, January 22, 2015","NIGERIA - Poultry mortalities from highly pathogenic avian influenza have been reported in the states of Ogun, Delta, Edo and Rivers. Farmers are being urged to raise biosecurity and consumers are warned only to buy poultry from reliable sources.","Avian Flu Spreads to New Nigerian States","ThePoultrySite News Desk","http://www.thepoultrysite.com/bird-flu/bird-flu-news.php?offset=1020"
"925","Thursday, January 22, 2015","US - A second city in Washington state, Port Angeles, is under quarantine while state and federal officials make sure a highly contagious strain of avian influenza (H5N2) has not spread.The state Department of Agriculture issued the quarantine on 21 January for six miles around a property between Port Angeles and Sequim after a backyard flock contracted the flu, which is deadly to birds but not contagious to humans.The 118 birds in the Port Angeles flock of chickens, geese and ducks were euthanised on 18 January as part of efforts to control the disease.","Port Angeles Quarantined after Flock Found with Avian Flu","Tri-City Herald","http://www.thepoultrysite.com/bird-flu/bird-flu-news.php?offset=1020"
"926","Wednesday, January 21, 2015","EGYPT - Health officials have reported the country's fourth and fifth deaths from H5N1 avian flu this year, according to Reuters. The victims were a 47-year-old woman from the Asyut governorate and a six-year-old child from Minya province. A new human case of H5N1 was reported in a 36-year-old woman from the Cairo governorate, according to FluTrackers.Egypt's Ministry of Health and Population also confirmed four recent cases of H5N1, according to an Avian Flu Diary post on 18 January: a 27-year-old woman from Monoufia, a 43-year-old woman from Asyut, a three-year-old girl from Cairo governorate and a 35-year-old woman from Sohag governorate.The new cases and deaths bring Egypt's H5N1 avian flu case total for this year to 20. Nine people are receiving treatment, six have recovered and five have died, Reuters said.","Egypt Reports Two H5N1 Deaths, Three New Cases","CIDRAP","http://www.thepoultrysite.com/bird-flu/bird-flu-news.php?offset=1020"
"927","Wednesday, January 21, 2015","NIGERIA - The Rivers State Government has confirmed the discovery of the avian influenza in the state. The State Commissioner for Agriculture, Emma Chinda, said the avian disease was confirmed after a thorough test was carried out on a bird which was showing signs last week. The farm is under quarantine and owners of neighbouring poultry farms have been advised to set up bio-security measures.","Avian Flu Confirmed in Rivers State, Nigeria","Daily Post","http://www.thepoultrysite.com/bird-flu/bird-flu-news.php?offset=1020"
"928","Wednesday, January 21, 2015","US - Idaho State Department of Agriculture has initiated a multi-agency
investigation following the confirmation of a highly pathogenic strain of the avian influenza virus (HPAI), originating from wild waterfowl, in western and southern Idaho.Surveillance conducted in Gooding County identified several cases of H5N8 avian influenza in wild ducks. The H5N2 strain of the virus has been confirmed in three falcons from a private, non-commercial flock in Canyon County following recent contact with wild waterfowl, and a small backyard poultry flock in the same area has chickens positive for H5N2.","Avian Influenza Virus Confirmed in Idaho Birds, Poultry","Idaho State Department of Agriculture","http://www.thepoultrysite.com/bird-flu/bird-flu-news.php?offset=1020"
"929","Wednesday, January 21, 2015","TAIWAN - More than half a million poultry have already been culled in Taiwan following the detection of one of the three high-path avian influenza virus subtypes circulating in the country. The government is offering full compensation to affected farmers and is considering whether poultry meat imports are required to meet demand at Chinese New Year.","Taiwan Set to Import Poultry Meat as Bird Flu Outbreaks Continue","ThePoultrySite News Desk","http://www.thepoultrysite.com/bird-flu/bird-flu-news.php?offset=1020"
"930","Wednesday, January 21, 2015","WASHINGTON STATE, US - A third smallholder flock of poultry in the state has been culled following confirmation of infection with the highly pathogenic H5N2 avian influenza virus.","Third Avian Flu Outbreak in Washington State Poultry","ThePoultrySite News Desk","http://www.thepoultrysite.com/bird-flu/bird-flu-news.php?offset=1020"
"931","Wednesday, January 21, 2015","JAPAN - Almost 73,000 broiler breeders at a farm in Saga prefecture in the north-west of the island of Kyushu have been culled following the detection of the H5N8 high-path bird flu virus.","Bird Flu Hits Japanese Broiler Breeder Flock","ThePoultrySite News Desk","http://www.thepoultrysite.com/bird-flu/bird-flu-news.php?offset=1020"
"932","Wednesday, January 21, 2015","TAIWAN - The latest report from the veterinary authority describes 28 new outbreaks of H5N8 high-path avian flu on goose and ducks farms in the west of the country in the most recent week. More than 109,000 birds have been affected in this week alone.","Taiwan Makes Official Report on 28 New Avian Flu Outbreaks","ThePoultrySite News Desk","http://www.thepoultrysite.com/bird-flu/bird-flu-news.php?offset=1020"
"933","Tuesday, January 20, 2015","CHINA - On 13 January 2015, the National Health and Family Planning Commission (NHFPC) of China notified WHO of 15 additional laboratory-confirmed cases of human infection with avian influenza A(H7N9) virus, including three deaths. The previous report was on 30 December.","Human Infection with Avian Influenza A(H7N9) Virus – China - 19 January 2015","World Health Organization (WHO)","http://www.thepoultrysite.com/bird-flu/bird-flu-news.php?offset=1020"
"934","Tuesday, January 20, 2015","ISRAEL - The detection of H5N1 highly pathogenic avian influenza in a turkey flock in the Haifa district has resulted in the cull of 100,000 birds at the outbreak farm and a close neighbour.","High-path Bird Flu Hits Turkeys in Israel","ThePoultrySite News Desk","http://www.thepoultrysite.com/bird-flu/bird-flu-news.php?offset=1020"
"935","Monday, January 19, 2015","NIGERIA - A second outbreak of highly pathogenic avian flu in the country has been confirmed at Badore, near Lagos in the south-west, where 2,000 poultry have been culled. The previous outbreak was in the far north of Nigeria and the government has embarked on active surveillance.","More Poultry Lost to Avian Flu in Nigeria","ThePoultrySite News Desk","http://www.thepoultrysite.com/bird-flu/bird-flu-news.php?offset=1020"
"936","Friday, January 16, 2015","TAIWAN - As bird flu sweeps across Taiwan, a new strain of the avian influenza virus - H5N3 - has been detected for the first time in the country.","New Avian Influenza Virus Strain Detected in Taiwan","ThePoultrySite News Desk","http://www.thepoultrysite.com/bird-flu/bird-flu-news.php?offset=1020"
"937","Friday, January 16, 2015","OREGON, US - Highly pathogenic avian influenza strain H5N2 has been found in a mallard harvested by a hunter at Fern Ridge Wildlife Area near Eugene, Oregon. The virus strain, known as H5N2, poses no immediate threat to human health. It has been circulating in Europe and East Asia and has not made people sick. The female mallard was sampled on 20 December 2014 as part of routine testing. It is the same strain that was detected in a pintail duck in north-western Washington state last month.","Avian Flu Virus Found in Wild Duck in Oregon","Oregon Department of Fish & Wildlife","http://www.thepoultrysite.com/bird-flu/bird-flu-news.php?offset=1020"
"938","Friday, January 16, 2015","CHINA - Twelve years of surveillance of H10 avian flu viruses in poultry and migratory birds in southern China — tracing the origins of the H10N8 and H10N6 strains — demonstrate the severe threat to public health posed by the viruses as they reassort in the fertile influenza ecosystem of China, according to findings of a study in the 'Journal of Virology'.The researchers, from several Chinese institutions as well as St Jude Children's Research Hospital in Memphis, Tennessee, US, carried out systematic surveillance at live-poultry markets and sentinel duck farms in six provinces of southern China as well as in uninhabited areas of Poyang Lake and at farms adjacent to the lake from 2002 to 2014.","H10 Evolution in China Highlights Threat to Public Health","CIDRAP Avian Flu Scan","http://www.thepoultrysite.com/bird-flu/bird-flu-news.php?offset=1020"
"939","Friday, January 16, 2015","GLOBAL - From 2003 to 6 January 2015, 694 laboratory-confirmed human cases of avian influenza A(H5N1) virus infection have been officially reported to WHO from 16 countries. Of these cases, 402 have died.Since the last update on 4 December 2014, 18 new laboratory-confirmed human cases of influenza A(H5N1) virus infection were reported to WHO, including four fatal cases in Egypt.This report also covers human infections with avian influenza A virus of the types H5N6 and H7N9 in China in a section entitled 'Human infection with other non-seasonal influenza viruses' and 'Outbreaks in animals with avian influenza viruses with potential public health impact'.","Influenza at the Human-Animal Interface: Summary and Assessment as of 6 January 2015","World Health Organization (WHO)","http://www.thepoultrysite.com/bird-flu/bird-flu-news.php?offset=1020"
"940","Friday, January 16, 2015","TAIWAN - In Follow-up Report 2, the veterinary authority reports eight new outbreaks of highly pathogenic avian influenza, again all in farmed geese, starting between 10 and 12 January. ","Eight Further Avain Flu Outbreaks in Taiwanese Geese","OIE","http://www.thepoultrysite.com/bird-flu/bird-flu-news.php?offset=1020"
"941","Monday, February 02, 2015","ISRAEL - Highly pathogenic avian influenza has hit another turkey flock in the same area as previous recent outbreaks.","Another Israeli Turkey Flock Hit by Bird Flu","ThePoultrySite News Desk","http://www.thepoultrysite.com/bird-flu/bird-flu-news.php?offset=1000"
"942","Friday, January 30, 2015","CHINA - For the seventh day in a row, China's Guangdong province reported more H7N9 avian influenza cases, in three adults from different locations, according to a report today from Hong Kong's Centre for Health Protection (CHP). The patients include two men, a 21-year-old from Shenzhen and a 59-year-old from Meizhou. Both are in hospital in a stable condition. The third patient is a 42-year-old woman from Foshan who is in hospital in a critical condition.These illnesses lift the global H7N9 total to 538 cases, according to a case list kept by FluTrackers.","China Admits Three More to Hospital with H5N9 Virus","CIDRAP","http://www.thepoultrysite.com/bird-flu/bird-flu-news.php?offset=1000"
"943","Thursday, January 29, 2015","TAIWAN - More than one million poultry - mainly geese - have been affected by the latest 197 outbreaks of highly pathogenic avian influenza in the west of the country. Virus strains H5N3, H5N2 and H5N8, on some cases in combination in a single outbreak, have been identified.","Avian Flu Situation in Taiwanese Poultry Worsens","ThePoultrySite News Desk","http://www.thepoultrysite.com/bird-flu/bird-flu-news.php?offset=1000"
"944","Thursday, January 29, 2015","INDIA - A turkey flock in Kerala has been hit by high-path avian flu of the H5N1 variant.","Turkey Flock in India Hit by Avian Flu","ThePoultrySite News Desk","http://www.thepoultrysite.com/bird-flu/bird-flu-news.php?offset=1000"
"945","Thursday, January 29, 2015","WASHINGTON STATE, US - The avian flu quarantine has been lifted in Benton and Franklin counties, while restrictions remain in place in parts of Clallam County.","Bird Flu Restrictions Lifted in Two Washington State Counties","ThePoultrySite News Desk","http://www.thepoultrysite.com/bird-flu/bird-flu-news.php?offset=1000"
"946","Wednesday, January 28, 2015","HONG KONG - On 23 January 2015, the Department of Health, Hong Kong Special Administrative Region notified WHO of one additional laboratory-confirmed case of human infection with avian influenza A(H7N9) virus. The patient is a 79-year-old man who developed symptoms on 19 January and was admitted to hospital, where he is in a stable condition. Based on information available thus far, it is considered that the patient was infected outside Hong Kong. Initial epidemiological investigations revealed that he travelled to Zhangmutou, Dongguan, Guangdong on 5 January. During his travels, the patient visited a wet market with live poultry stalls but had no direct contact with poultry. He returned to Hong Kong on 19 January. ","Human Infection with Avian Influenza A(H7N9) Virus – China","World Health Organization","http://www.thepoultrysite.com/bird-flu/bird-flu-news.php?offset=1000"
"947","Wednesday, January 28, 2015","BULGARIA - In the framework of the passive surveillance under the national avian influenza surveillance and control programme, a Dalmatian pelican (Pelecanus crispus) produced a real-time PCR-positive result for highly pathogenic avian influenza subtype H5N1 was found dead on 22 January in Poda protected area in the east of the country. The pelican was found dead together with a black-headed gull (Chroicocephalus ridibundus), which tested negative for avian flu.","H5N1 Virus Detected in Wild Water Bird in Bulgaria","OIE","http://www.thepoultrysite.com/bird-flu/bird-flu-news.php?offset=1000"
"948","Wednesday, January 28, 2015","CANADA - The first North American human case of H7N9 bird flu has been confirmed in British Columbia.
Canadian health officials announced on 26 January that a woman in her 50s from the Lower Mainland has tested positive for avian influenza A(H7N9), following a visit to China. A man who travelled with her is believed to have been infected as well. They only developed symptoms after returning home to Canada earlier this month. Both are recovering well without admission to hospital.","British Columbia Woman Tests Positive for H7N9 Bird Flu after Trip to China","Vancouver Sun","http://www.thepoultrysite.com/bird-flu/bird-flu-news.php?offset=1000"
"949","Wednesday, January 28, 2015","EGYPT - The health ministry reported that a 31-year-old woman from Giza governorate has died of H5N1 avian flu. Of the 31 cases of H5N1 avian flu reported in Egypt this year, 10 people have now died. The Egyptian Ministry of Health and Population also announced that two more people have been hospitalised with H5N1; a four-year-old girl from Cairo and a 34-year-old woman from Al-Sharqia governorate, which is north of Cairo near the Nile Delta. Two people with H5N1 avian flu have recovered.","Bird Flu Kills Woman in Giza","Daily News Egypt","http://www.thepoultrysite.com/bird-flu/bird-flu-news.php?offset=1000"
"950","Monday, January 26, 2015","US - A poultry processor's early detection programme has identified avian influenza in a single turkey flock in California.","Avian Flu Virus Detected in Californian Turkey Flock","ThePoultrysite News Desk","http://www.thepoultrysite.com/bird-flu/bird-flu-news.php?offset=1000"
"951","Monday, January 26, 2015","NIGERIA - The highly pathogenic avian influenza of the H5N1 variant has been identified as the cause of seven new outbreaks of the disease in poultry in the last week in the north and centre of the country.","Nigeria Reports Seven New Outbreaks of Bird Flu in Poultry","ThePoultrySite News Desk","http://www.thepoultrysite.com/bird-flu/bird-flu-news.php?offset=1000"
"952","Monday, January 26, 2015","BELIZE - During routine testing, the low-pathogenic avian influenza virus of the H5N2 has been detected in broiler breeders in the west of the country in December 2014.","Low-pathogenic Avian Flu Virus Detected in Belize Poultry","ThePoultrySite News Desk","http://www.thepoultrysite.com/bird-flu/bird-flu-news.php?offset=1000"
"953","Monday, January 26, 2015","TAIWAN - The Council of Agriculture has imposed a four-day ban on killing chickens, ducks and geese in a bid to prevent the spread of the avian flu among poultry; more than half a million birds have been culled due to infections.","Taiwan Stops Poultry Slaughter to Control Avian Flu Spread","ThePoultrySite News Desk","http://www.thepoultrysite.com/bird-flu/bird-flu-news.php?offset=1000"
"954","Sunday, January 25, 2015","CHINA & HONG KONG - Chinese authorities have reported four new H7N9 avian flu cases on 23 January, three of which occurred on the Chinese mainland and one that was likely imported from southern China to Hong Kong.Hong Kong's Centre for Health Protection (CHP) confirmed H7N9 infection in a 79-year-old man who presented to a clinic with respiratory symptoms on 19 January and was admitted to hospital and isolated in stable condition. The man travelled to the mainland provinces of Zhangmutou, Dongguan and Guangdong on 5 January, where he visited a live-poultry market but had no contact with birds.","H7N9 Sickens Three People in Mainland China, One in Hong Kong","CIDRAP","http://www.thepoultrysite.com/bird-flu/bird-flu-news.php?offset=1000"
"955","Sunday, January 25, 2015","EGYPT - The death toll of the patients who contracted H5N1 bird flu virus rose to eight in 2015 after a death case for a five-year-old boy in Upper Egypt’s governorate of Asyut was reported on 23 January, according to Ministry of Health. The ministry said a new case was infected with the virus; it was for a 60-year-old woman in the Delta governorate of Gharbia.","Egypt Reports Eighth Bird Flu Death in 2015 ","Cairo Post","http://www.thepoultrysite.com/bird-flu/bird-flu-news.php?offset=1000"
