"","newDates","snips","items","sources","URL"
"1327","Tuesday, June 02, 2015","SAUDI ARABIA - The Saudi Food and Drug Authority (SFDA) has temporarily banned the import of poultry meat, eggs, their products and equipment from five more regions in the United States because of the spread of severe bird flu disease there.","Saudi Arabia Bans Poultry Imports from US, Bhutan","ThePoultrySite News Desk","http://www.thepoultrysite.com/bird-flu/bird-flu-news.php?offset=620"
"1328","Tuesday, June 02, 2015","ARMENIA - Armenia has banned the import of poultry products from a number of US states over bird flu concerns, the press service of the Armenian Agriculture Ministry’s service on food safety has said.","Armenia Bans US Poultry Imports","ThePoultrySite News Desk","http://www.thepoultrysite.com/bird-flu/bird-flu-news.php?offset=620"
"1329","Tuesday, June 02, 2015","US - Avian influenza has been ravaging the US poultry industry, but what are poultry researchers doing to decrease the impact of the disease in future?","How Do Researchers Develop Avian Flu Vaccines?","ThePoultrySite News Desk","http://www.thepoultrysite.com/bird-flu/bird-flu-news.php?offset=620"
"1330","Tuesday, June 02, 2015","The avian flu outbreak that has affected more than 44 million birds in around 15 states has triggered fast-food restaurant Whataburger to alter its breakfast hours because of the nationwide egg shortage.","Whataburger cracks: Cuts breakfast hours due to egg shortage from bird-flu","rt.com","http://www.thepoultrysite.com/bird-flu/bird-flu-news.php?offset=620"
"1331","Tuesday, June 02, 2015","MBABANE – The country’s poultry industry is exposed to the bird flu outbreak which is a serious cause for concern.","Poultry Industry Exposed to Bird Flu Outbreak","http://www.times.co.sz/","http://www.thepoultrysite.com/bird-flu/bird-flu-news.php?offset=620"
"1332","Monday, June 01, 2015","US - There have been six further confirmed outbreaks of H5N2 highly pathogenic avian influenza (HPAI) in the US, predominantly in Minnesota.","Six More US Bird Flu Outbreaks","ThePoultrySite News Desk","http://www.thepoultrysite.com/bird-flu/bird-flu-news.php?offset=620"
"1333","Monday, June 01, 2015","GLOBAL - The global case of avian flu has had a big impact on international markets.","Avian Flu Challenging Global Trade","ThePoultrySite News Desk","http://www.thepoultrysite.com/bird-flu/bird-flu-news.php?offset=620"
"1334","Monday, June 01, 2015","Indiana is training 300 prisoners to kill infected chickens and banning bird shows at county fairs. Mississippi is considering road barricades and planning biosecurity measures. Iowa is trying to figure out how to deal with a mountain of dead - and reeking - chickens.","States enlist prisoners, plan biosecurity to combat avian flu threat","ThePoultrySite News Desk","http://www.thepoultrysite.com/bird-flu/bird-flu-news.php?offset=620"
"1335","Monday, June 01, 2015","TAIWAN - There have been further outbreaks of two different serotypes of highly pathogenic avian influenza in Taiwan.","Avian Flu Continues to Affect Taiwan","ThePoultrySite News Desk","http://www.thepoultrysite.com/bird-flu/bird-flu-news.php?offset=620"
"1336","Friday, May 29, 2015","US - Four more outbreaks of H5N2 highly pathogenic avian influenza (HPAI) have been confirmed by the US Department of Agriculture (USDA).","Four More US Avian Flu Outbreaks Confirmed","ThePoultrySite News Desk","http://www.thepoultrysite.com/bird-flu/bird-flu-news.php?offset=620"
"1337","Friday, May 29, 2015","COTE D'IVOIRE - An outbreak of highly pathogenic avian influenza has been confirmed in Cote d'Ivoire.","Avian Flu Outbreak in Cote d'Ivoire","ThePoultrySite News Desk","http://www.thepoultrysite.com/bird-flu/bird-flu-news.php?offset=620"
"1338","Friday, May 29, 2015","Local folks are cleaning up and moving on as the worst bird flu outbreak in U.S. history continues to spread.","Proper disposal key to moving on after bird flu","http://bismarcktribune.com/","http://www.thepoultrysite.com/bird-flu/bird-flu-news.php?offset=620"
"1339","Thursday, May 28, 2015","US - Two more outbreaks of H5N2 highly pathogenic avian influenza (HPAI) have been confirmed in the US states of Iowa and Nebraska.","Two More Avian Influenza Outbreaks Confirmed in US","ThePoultrySite News Desk","http://www.thepoultrysite.com/bird-flu/bird-flu-news.php?offset=620"
"1340","Thursday, May 28, 2015","Mexico is working hard to prevent outbreaks of a bird flu epidemic that has stricken the U.S. poultry and egg industry in recent months, a senior Mexican agriculture ministry official said on Wednesday.
","Mexico working hard to prevent new outbreaks of bird flu: official","http://www.dailymail.co.uk","http://www.thepoultrysite.com/bird-flu/bird-flu-news.php?offset=620"
"1341","Monday, June 15, 2015","TAIWAN - Three more outbreaks of highly pathogenic avian influenza have been confirmed in Taiwan.","Further Avian Flu Outbreaks in Taiwan","ThePoultrySite News Desk","http://www.thepoultrysite.com/bird-flu/bird-flu-news.php?offset=600"
"1342","Monday, June 15, 2015","There’s relief ahead for U.S. poultry farmers suffering through the worst ever domestic outbreak of bird flu.","Warm Weather Bringing Relief from Record U.S. Bird-Flu Outbreak","http://www.rocketnews.com/","http://www.thepoultrysite.com/bird-flu/bird-flu-news.php?offset=600"
"1343","Monday, June 15, 2015","In the face of a bird flu outbreak killing chickens and increasing egg prices, South Carolina officials and farmers are working to protect an industry worth millions to the region.","Farmers protecting flocks worth millions to region","http://thetandd.com/","http://www.thepoultrysite.com/bird-flu/bird-flu-news.php?offset=600"
"1344","Friday, June 12, 2015","US - There have been few announcements of new highly pathogenic avian influenza outbreaks in recent days, but shows still continue to be cancelled as regulators look to prevent the disease spreading.","Avian Flu Spread Slowing, but Shows Still Being Cancelled","ThePoultrySite News Desk","http://www.thepoultrysite.com/bird-flu/bird-flu-news.php?offset=600"
"1345","Friday, June 12, 2015","GHANA - Ghana's poultry association and government ministers have asked consumers of chicken not to panic over the outbreaks of highly pathogenic avian influenza in the country.","Ghana Chicken Consumers Reassured After Bird Flu Outbreak","ThePoultrySite News Desk","http://www.thepoultrysite.com/bird-flu/bird-flu-news.php?offset=600"
"1346","Friday, June 12, 2015","The average price of a dozen eggs in the United States will climb to a record high this year due to the nation's worst-ever outbreak of bird flu in poultry, U.S. Department of Agriculture data issued on Wednesday showed.","U.S. egg prices to hit record high due to bird flu: USDA","http://www.reuters.com/","http://www.thepoultrysite.com/bird-flu/bird-flu-news.php?offset=600"
"1347","Thursday, June 11, 2015","US - Another outbreak of H5N2 highly pathogenic avian influenza (HPAI) has been confirmed in the US state of Iowa.","Further Avian Flu Outbreak Confirmed in Iowa","ThePoultrySite News Desk","http://www.thepoultrysite.com/bird-flu/bird-flu-news.php?offset=600"
"1348","Thursday, June 11, 2015","GHANA - There has been a new outbreak of H5N1 highly pathogenic avian influenza in Ghana.","More Avian Flu Hits Ghana","ThePoultrySite News Desk","http://www.thepoultrysite.com/bird-flu/bird-flu-news.php?offset=600"
"1349","Tuesday, June 09, 2015","US - Two more H5N2 highly pathogenic avian influenza outbreaks have been confirmed by the US Department of Agriculture's Animal and Plant Health Inspection Service.","Further Two Avian Flu Outbreaks Confirmed in US","ThePoultrySite News Desk","http://www.thepoultrysite.com/bird-flu/bird-flu-news.php?offset=600"
"1350","Tuesday, June 09, 2015","SOUTH AFRICA - There have been three outbreaks of low pathogenic avian influenza, of the H5N2 serotype, in South Africa.","Low Pathogenic Avian Flu Outbreak in South Africa","ThePoultrySite News Desk","http://www.thepoultrysite.com/bird-flu/bird-flu-news.php?offset=600"
"1351","Tuesday, June 09, 2015","With an increasing egg shortage due to the widespread bird flu outbreak, the United States will soon allow imported egg products from the Netherlands to be used for commercial baking and in processed foods.","Netherlands to save US after bird flu outbreak by sending egg products","http://www.theguardian.com/","http://www.thepoultrysite.com/bird-flu/bird-flu-news.php?offset=600"
"1352","Monday, June 08, 2015","US - There have been five new outbreaks of H5N2 highly pathogenic avian influenza confirmed in the US.","Five More Confirmed US Bird Flu Outbreaks","ThePoultrySite News Desk","http://www.thepoultrysite.com/bird-flu/bird-flu-news.php?offset=600"
"1353","Monday, June 08, 2015","In recent days, an ominous sign has appeared throughout Texas. ""Eggs [are] not for commercial sale,"" read warnings, printed on traditional 8 1/2-by-11-inch pieces of white paper and posted at H-E-B grocery stores across Texas. ""The purchase of eggs is limited to 3 cartons of eggs per customer.""","Egg rationing in America has officially begun","http://www.washingtonpost.com/","http://www.thepoultrysite.com/bird-flu/bird-flu-news.php?offset=600"
"1354","Monday, June 08, 2015","The worst avian flu outbreak in the nation’s history has spawned a series of investigations by Minnesota disease researchers to figure out why this new and exceptionally deadly virus is behaving in such bizarre ways.","Scientists race to decode secrets of deadly bird flu","http://www.startribune.com/","http://www.thepoultrysite.com/bird-flu/bird-flu-news.php?offset=600"
"1355","Friday, June 05, 2015","US - The US Department of Agriculture has said that vaccines for protection against highly pathogenic avian influenza (HPAI) have not been approved because they are not effective enough.","USDA Says Avian Flu Vaccine Not Effective Enough","ThePoultrySite News Desk","http://www.thepoultrysite.com/bird-flu/bird-flu-news.php?offset=600"
"1356","Friday, June 05, 2015","US - Five more outbreaks of H5N2 highly pathogenic avian influenza (HPAI) have been confirmed in the US.","Further US Avian Flu Outbreaks Confirmed; Nebraska Cancels Shows","ThePoultrySite News Desk","http://www.thepoultrysite.com/bird-flu/bird-flu-news.php?offset=600"
"1357","Friday, June 05, 2015","VIET NAM - An outbreak of H5N6 highly pathogenic avian influenza (HPAI) has been confirmed in Viet Nam.","More Avian Flu Found in Viet Nam","ThePoultrySite News Desk","http://www.thepoultrysite.com/bird-flu/bird-flu-news.php?offset=600"
"1358","Friday, June 05, 2015","TAIWAN - Two more outbreaks of H5N2 highly pathogenic avian influenza (HPAI) have been confirmed in Taiwan.","Further Two Outbreaks of Avian Flu Confirmed in Taiwan","ThePoultrySite News Desk","http://www.thepoultrysite.com/bird-flu/bird-flu-news.php?offset=600"
"1359","Thursday, June 04, 2015","US - Two more outbreaks of H5N2 highly pathogenic avian influenza (HPAI) have been confirmed by the US Department of Agriculture (USDA).","Two More US Bird Flu Outbreaks Confirmed","ThePoultrySite News Desk","http://www.thepoultrysite.com/bird-flu/bird-flu-news.php?offset=600"
"1360","Thursday, June 04, 2015","State Agriculture Commissioner Richard A. Ball today announced new regulations restricting the movement of poultry into the state to prevent the spread of strains of highly pathogenic avian influenza (HPAI) in poultry flocks in New York State.","Agriculture Commissioner Announces New Regulations to Prevent Spread of Avian Influenza in New York State","http://www.4-traders.com/","http://www.thepoultrysite.com/bird-flu/bird-flu-news.php?offset=600"
"1361","Tuesday, June 23, 2015","CHINA - Chinese researchers who analysed influenza viruses from poultry in live-bird markets say they have discovered a novel H5N9 virus, which is a hybrid of various other avian influenza viruses.","Novel Avian Flu Virus Discovered in China","ThePoultrySite News Desk","http://www.thepoultrysite.com/bird-flu/bird-flu-news.php?offset=580"
"1362","Tuesday, June 23, 2015","WILLMAR — The biggest lesson from the outbreak of the highly pathogenic avian influenza in Minnesota is that this virus has behaved differently than anything dealt with previously, according to veterinarian Trevor Ames, dean of the College of Veterinary Medicine at the University of Minnesota.","Willmar lab playing role as poultry industry looks for answers to avian flu","http://www.grandforksherald.com/","http://www.thepoultrysite.com/bird-flu/bird-flu-news.php?offset=580"
"1363","Monday, June 22, 2015","CHINA - Two new outbreaks of highly pathogenic avian influenza have been reported in China.","New Avian Flu Outbreaks Reported in China","ThePoultrySite News Desk","http://www.thepoultrysite.com/bird-flu/bird-flu-news.php?offset=580"
"1364","Friday, June 19, 2015","GHANA - Five new outbreaks of highly pathogenic avian influenza have been confirmed in Ghana.","Five More Avian Flu Outbreaks Found in Ghana","ThePoultrySite News Desk","http://www.thepoultrysite.com/bird-flu/bird-flu-news.php?offset=580"
"1365","Friday, June 19, 2015","TAIWAN - Two new outbreaks of highly pathogenic avian influenza subtype H5N2 have been confirmed in Taiwan.","Two New Avian Flu Outbreaks in Taiwan","ThePoultrySite News Desk","http://www.thepoultrysite.com/bird-flu/bird-flu-news.php?offset=580"
"1366","Friday, June 19, 2015","Officials predict avian influenza will hit the East Coast as early as this fall","Massachusetts gets ready for the flu","http://www.morningagclips.com/","http://www.thepoultrysite.com/bird-flu/bird-flu-news.php?offset=580"
"1367","Thursday, June 18, 2015","US - One new case of H5N2 highly pathogenic avian influenza (HPAI) has been confirmed in the US, ending an eight-day hiatus of new detections.","USDA Confirms New Avian Flu Outbreak in Iowa","ThePoultrySite News Desk","http://www.thepoultrysite.com/bird-flu/bird-flu-news.php?offset=580"
"1368","Thursday, June 18, 2015","SINGAPORE - A poultry 'biochip' has been launched when can detect nine major poultry disease using a single sample applied to the portable, disposable chip.","Disease-Detecting Poultry Biochip Launched in Singapore","ThePoultrySite News Desk","http://www.thepoultrysite.com/bird-flu/bird-flu-news.php?offset=580"
"1369","Thursday, June 18, 2015","GLOBAL - An exceptional group of people from across the global egg industry have agreed to be a part of the International Egg Commission (IEC) Avian Influenza Communications Network which is being launched this week.","International Egg Commission Announces Avian Flu Communications Network","ThePoultrySite News Desk","http://www.thepoultrysite.com/bird-flu/bird-flu-news.php?offset=580"
"1370","Wednesday, June 17, 2015","US - The US is currently on the tail end of the worst bird flu outbreak in history, causing concerns over the potential effects on the feed market, write John Newton and Todd Kuethe from the University of Illinois' Farmdoc Daily Project.","How Will Avian Flu Impact US Feed Markets?","ThePoultrySite News Desk","http://www.thepoultrysite.com/bird-flu/bird-flu-news.php?offset=580"
"1371","Wednesday, June 17, 2015","IRAN - An outbreak of highly pathogenic avian influenza has been confirmed in Iran.","Avian Flu Outbreak Found in Iran","ThePoultrySite News Desk","http://www.thepoultrysite.com/bird-flu/bird-flu-news.php?offset=580"
"1372","Wednesday, June 17, 2015","US - The United States Department of Agriculture’s Animal and Plant Health Inspection Service (APHIS) has released an epidemiology report, describing how highly pathogenic avian influenza (HPAI) has been infecting new premises.","Avian Flu Spread Various Ways, USDA Report Says","ThePoultrySite News Desk","http://www.thepoultrysite.com/bird-flu/bird-flu-news.php?offset=580"
"1373","Wednesday, June 17, 2015","DES MOINES, Iowa — A bird flu outbreak in the Midwest that's boosted prices for eggs and roasting turkeys has actually resulted in cheaper chicken in the United States, as many countries restrict imports of poultry products, the Department of Agriculture said in a report released Tuesday.","Bird flu leads to lower chicken prices in U.S.","http://triblive.com/","http://www.thepoultrysite.com/bird-flu/bird-flu-news.php?offset=580"
"1374","Wednesday, June 17, 2015","On June 12, 2015, the National Health and Family Planning Commission (NHFPC) of China notified the World Health Organization (WHO) of 15 additional laboratory-confirmed cases of human infection with avian influenza A (H7N9) virus, including three deaths.","15 Cases of Human Infection With H7N9 Virus in China are Reported to WHO","http://www.infectioncontroltoday.com/","http://www.thepoultrysite.com/bird-flu/bird-flu-news.php?offset=580"
"1375","Wednesday, June 17, 2015","Chickens and eggs that may have been exposed to avian influenza were shipped to 37 states across the country, including Georgia, where officials ordered three small flocks destroyed on Tuesday to protect other birds.","Birds Shipped Across the Country May Have Had Avian Flu","http://growingalabama.com/","http://www.thepoultrysite.com/bird-flu/bird-flu-news.php?offset=580"
"1376","Tuesday, June 16, 2015","RUSSIA - An outbreak of highly pathogenic avian influenza has been confirmed in wild birds in Russia.","Avian Flu Outbreak Reported in Russia","ThePoultrySite News Desk","http://www.thepoultrysite.com/bird-flu/bird-flu-news.php?offset=580"
"1377","Tuesday, June 16, 2015","GERMANY - There has been an outbreak of low pathogenic avian influenza in Niedersachsen in Germany.","Low Pathogenic Avian Flu Outbreak in Germany","ThePoultrySite News Desk","http://www.thepoultrysite.com/bird-flu/bird-flu-news.php?offset=580"
"1378","Tuesday, June 16, 2015","US - It appears that the incidence and spread of high pathogenic avian influenza (HPAI) is, as expected, slowing as the weather warms up, write Steve Meyer and Len Steiner.","CME: Bird Flu Impact on US Slowing, But Concerns Remain","ThePoultrySite News Desk","http://www.thepoultrysite.com/bird-flu/bird-flu-news.php?offset=580"
"1379","Tuesday, June 16, 2015","Minnesota poultry farmers who have suffered losses due to highly pathogenic avian influenza are eligible for disaster loans through the Minnesota Rural Finance Authority (RFA). ","MN offering loans to those affected by avian flu","http://kelo.com/","http://www.thepoultrysite.com/bird-flu/bird-flu-news.php?offset=580"
"1380","Monday, June 15, 2015","US - The House of Representatives has gotten quite busy on a couple of issues important to the livestock and poultry sectors, write Steve Meyer and Len Steiner.","CME: US 2015 Egg, Turkey Production Expected to Fall","ThePoultrySite News Desk","http://www.thepoultrysite.com/bird-flu/bird-flu-news.php?offset=580"
"1381","Wednesday, July 15, 2015","SOUTH AFRICA - There have been four outbreaks of low pathogenic avian influenza on ostrich farms in South Africa.","Low Pathogenic Avian Flu Outbreaks Found in South African Ostriches","ThePoultrySite News Desk","http://www.thepoultrysite.com/bird-flu/bird-flu-news.php?offset=560"
"1382","Tuesday, July 14, 2015","TAIWAN - There have been three more outbreaks of highly pathogenic avian influenza in Taiwan.","Further Avian Flu Outbreaks Affecting Taiwan","ThePoultrySite News Desk","http://www.thepoultrysite.com/bird-flu/bird-flu-news.php?offset=560"
"1383","Monday, July 13, 2015","UK - An outbreak of avian influenza has been confirmed in Lancashire, and identified as the H7N7 variant of the disease.","UK Avian Flu Case Confirmed as H7N7","ThePoultrySite News Desk","http://www.thepoultrysite.com/bird-flu/bird-flu-news.php?offset=560"
"1384","Friday, July 10, 2015","US - To assist the poultry industry in preparing for potential future exposure to highly pathogenic avian influenza (HPAI), an 'Avian Influenza Outbreak…Lessons Learned' Conference has been scheduled for July.","Avian Influenza 'Lessons Learned' Conference to Prepare for Potential Future Outbreaks","ThePoultrySite News Desk","http://www.thepoultrysite.com/bird-flu/bird-flu-news.php?offset=560"
"1385","Friday, July 10, 2015","UK - The UK's Department for Environment, Food and Rural Affairs (Defra) is investigating a case of suspect avian flu in Lancashire and movement restrictions have been put in place.","Suspected Avian Flu Case Found on Lancashire Farm","ThePoultrySite News Desk","http://www.thepoultrysite.com/bird-flu/bird-flu-news.php?offset=560"
"1386","Thursday, July 09, 2015","US - The US Senate Committee on Agriculture, Nutrition and Forestry held a hearing recently on the impact of avian flu on the poultry sector, listening to a variety of witnesses and stakeholders.","US Senate Meeting Highlights Dramatic Impact of Avian Flu","ThePoultrySite News Desk","http://www.thepoultrysite.com/bird-flu/bird-flu-news.php?offset=560"
"1387","Wednesday, July 08, 2015","NIGERIA - There have been 46 new outbreaks of highly pathogenic avian influenza in Nigeria.","More Avian Flu Outbreaks Hit Nigeria","ThePoultrySite News Desk","http://www.thepoultrysite.com/bird-flu/bird-flu-news.php?offset=560"
"1388","Tuesday, July 07, 2015","WEST AFRICA - Scientists from West African countries are being trained in the early and accurate detection of the avian influenza virus using the latest techniques.","West African Scientists Trained in Latest Technology for Avian Flu Detection","ThePoultrySite News Desk","http://www.thepoultrysite.com/bird-flu/bird-flu-news.php?offset=560"
"1389","Monday, July 06, 2015","NETHERLANDS - The outbreaks of avian flu in the Netherlands in 2014 were caused by four separate introductions and one between-poultry transmission, according to new research published in Eurosurveillance.","Netherlands Avian Flu Resulted from Four Separate Introductions","ThePoultrySite News Desk","http://www.thepoultrysite.com/bird-flu/bird-flu-news.php?offset=560"
"1390","Friday, July 03, 2015","US - The US Department of Agriculture's Animal and Plant Health Inspection Service (USDA-APHIS) has published updated plans for surveillance of avian influenza in wild birds, which provide for an increase in sampling.","US Steps Up Wild Bird Monitoring for Avian Flu","ThePoultrySite News Desk","http://www.thepoultrysite.com/bird-flu/bird-flu-news.php?offset=560"
"1391","Wednesday, July 01, 2015","US - Outbreaks of highly pathogenic avian influenza (HPAI) serotype H5N2 appear to be slowing in the US, but the potential for new outbreaks as migrating birds move south in autumn is high, reports Eric Gingerich, DVM (Technical Specialist in Poultry, Diamond V).","How Can US Poultry Producers Protect Flocks from Avian Flu Threat?","ThePoultrySite News Desk","http://www.thepoultrysite.com/bird-flu/bird-flu-news.php?offset=560"
"1392","Tuesday, June 30, 2015","GHANA - There has been one new outbreak of highly pathogenic avian influenza in Ghana.","Another Outbreak of Avian Flu in Ghana","ThePoultrySite News Desk","http://www.thepoultrysite.com/bird-flu/bird-flu-news.php?offset=560"
"1393","Monday, June 29, 2015","A southwestern Iowa landfill has stopped accepting dead birds and related waste from the recent bird flu outbreak.","Iowa Landfill Stops Taking Dead Birds Affected by Bird Flu","http://kicdam.com/","http://www.thepoultrysite.com/bird-flu/bird-flu-news.php?offset=560"
"1394","Thursday, June 25, 2015","A lawsuit has been filed against a poultry operation in northwest Iowa that was hit by avian influenza. Michael Foods Egg Products Company, a subsidiary of St. Louis-based cereal maker Post Holdings Inc., filed the lawsuit in federal court in Des Moines on Monday.","Iowa poultry operation hit by bird flu sued by foods company","http://www.radioiowa.com/","http://www.thepoultrysite.com/bird-flu/bird-flu-news.php?offset=560"
"1395","Thursday, June 25, 2015","GHANA - Ghana's Northern Regional Veterinary Officer has called on the media to help create public awareness on the outbreak of the highly pathogenic H5N1 avian influenza in certain sections of the country.","Ghanaian Media Asked to Spread Awareness of Avian Flu","ThePoultrySite News Desk","http://www.thepoultrysite.com/bird-flu/bird-flu-news.php?offset=560"
"1396","Thursday, June 25, 2015","UK - The Global Alliance for Research on Avian Disease (GARAD) conference will be held between 29 June and 1 July, creating global partnerships to bring together the academic community and poultry industry.","Global Alliance Conference to Bring Together Avian Disease Researchers","ThePoultrySite News Desk","http://www.thepoultrysite.com/bird-flu/bird-flu-news.php?offset=560"
"1397","Wednesday, June 24, 2015","NIGERIA - There have been 30 new outbreaks of highly pathogenic avian influenza in Nigeria.","30 New Avian Flu Outbreaks Reported in Nigeria","ThePoultrySite News Desk","http://www.thepoultrysite.com/bird-flu/bird-flu-news.php?offset=560"
"1398","Wednesday, June 24, 2015","Naba Guigma, from Burkina Faso’s Boulkiemdé province, southwest of the capital Ouagadougou, watched helplessly as his chickens and guinea fowl began to die off one by one. His very livelihood – like that of the millions of other poultry farmers across West Africa – faces ruin.","Avian Flu Threatens West Africa Poultry Farmers – Analysis","http://www.eurasiareview.com/","http://www.thepoultrysite.com/bird-flu/bird-flu-news.php?offset=560"
"1399","Wednesday, June 24, 2015","Sacramento, California - Parts of the Midwest are dealing with a serious and ongoing outbreak of avian influenza, so California is taking extra steps to protect birds here.","Avian Influenza Update for Backyard Bird Owners, Commercial Poultry Farmers","http://www.imperialvalleynews.com/","http://www.thepoultrysite.com/bird-flu/bird-flu-news.php?offset=560"
"1400","Tuesday, June 23, 2015","ISRAEL - There has been another outbreak of highly pathogenic avian influenza in Israel.","Further Avian Flu Reported in Israel","ThePoultrySite News Desk","http://www.thepoultrysite.com/bird-flu/bird-flu-news.php?offset=560"
